source,url,title,published_at,tickers,sentiment,trust,recency,score
Business Insider,https://www.businessinsider.com/pope-leo-xiv-ai-morality-justice-2025-11,Pope Leo XIV asks the AI industry to 'cultivate moral discernment',2025-11-08T22:00:05Z,,0.5859,0.6,0.16567648999341195,0.07882390364416561
Slickdeals.net,https://slickdeals.net/f/18782887-putwo-metallic-markers-10-assorted-colors-fine-tip-waterproof-at-amazon-2,"PuTwo Metallic Markers, 10 Assorted Colors, Fine Tip, Waterproof at Amazon $2",2025-11-08T21:26:37Z,META,0.9153,0.6,0.16042371264954508,0.0921778610513021
TechCrunch,https://techcrunch.com/2025/11/08/is-wall-street-losing-faith-in-ai/,Is Wall Street losing faith in AI? | TechCrunch,2025-11-08T20:53:48Z,,0.6486,0.6,0.15543470883722812,0.07687489829671629
Yahoo Entertainment,https://finance.yahoo.com/news/wall-street-losing-faith-ai-205300697.html,Is Wall Street losing faith in AI?,2025-11-08T20:53:00Z,,0.8555,0.6,0.1553150442256995,0.08645611936823562
Slashdot.org,https://science.slashdot.org/story/25/11/08/0735217/chan-zuckerberg-initiative-shifts-bulk-of-philanthropy-going-all-in-on-ai-powered-biology,"Chan Zuckerberg Initiative Shifts Bulk of Philanthropy, 'Going All In on AI-Powered Biology'",2025-11-08T20:34:00Z,,0.6597,0.6,0.15249994095829764,0.07593124560254597
Naturalrunningcenter.com,https://naturalrunningcenter.com/visceral-fat-reduction-improve-your-healthspan/,Visceral Fat Reduction – Improve Your Healthspan,2025-11-08T20:20:19Z,,0.4404,0.6,0.15050423155570908,0.065035888539853
allears.net,https://allears.net/2025/11/08/hoka-vs-on-cloud-which-is-better-for-disney-world/,HOKA vs On Cloud: Which Is Better for Disney World?,2025-11-08T20:00:21Z,,0.7319,0.6,0.14763886623871428,0.07670872573164877
Gizmodo.com,https://gizmodo.com/pluribus-may-not-be-about-ai-but-vince-gilligan-hates-it-regardless-2000683400,"‘Pluribus’ May Not Be About AI, But Vince Gilligan Hates It Regardless",2025-11-08T20:00:13Z,,-0.9192,0.6,0.14761991590544923,0.0035783067615480888
Theflightdeal.com,https://www.theflightdeal.com/2025/11/08/american-san-francisco-new-delhi-india-659-basic-economy-761-regular-economy-roundtrip-including-all-taxes/,"American: San Francisco – New Delhi, India. $659 (Basic Economy) / $761 (Regular Economy). Roundtrip, including all Taxes",2025-11-08T19:55:57Z,,0.7003,0.6,0.147014804475191,0.07499078161475016
Yahoo Entertainment,https://finance.yahoo.com/news/buy-microsoft-msft-long-term-164339306.html,Should You Buy Microsoft (MSFT) For Long-Term AI Gains?,2025-11-08T16:43:39Z,MSFT,0.9648,0.6,0.12216898741842597,0.072011287943917
Wccftech,https://wccftech.com/microsoft-has-developed-toolkits-to-break-nvidia-cuda-dominance/,"Microsoft Has Reportedly Developed “Toolkits” to Break NVIDIA’s CUDA Dominance, Slashing Inference Costs with AMD AI GPUs",2025-11-08T15:44:28Z,AMD,-0.2023,0.6,0.11540286363732533,0.02761705929704832
Barchart.com,https://www.barchart.com/story/news/36004075/core-scientific-just-rejected-coreweaves-bid-should-you-buy-crwv-stock-here-or-stay-far-away,Core Scientific Just Rejected CoreWeave’s Bid. Should You Buy CRWV Stock Here or Stay Far Away?,2025-11-08T14:30:02Z,,0.9254,0.6,0.1074227370936828,0.06204952140005306
Biztoc.com,https://biztoc.com/x/fc3435a600a681cf,Microsoft (NASDAQ: MSFT) Stock Price Prediction and Forecast 2025-2030 (Nov 2025),2025-11-08T13:47:29Z,MSFT,0.4767,0.6,0.10311127945432223,0.045679327911059296
Blockspace.media,https://blockspace.media/insight/bitcoin-mining-news-cipher-lands-5-5b-aws-lease-iren-inks-9-7b-microsoft-deal-and-public-bitcoin-miner-q3-earnings/,"Bitcoin mining news: Cipher lands $5.5B AWS lease, IREN inks $9.7B Microsoft deal, and public bitcoin miner Q3 earnings",2025-11-08T11:00:00Z,,0.8074,0.6,0.08775701799858834,0.04758361029919456
MarketWatch,https://www.marketwatch.com/story/tech-stocks-are-having-their-worst-week-since-the-april-tariff-selloff-why-its-about-time-6334cbc3,Tech stocks just had their worst week since the April tariff selloff. Why it’s about time.,2025-11-07T21:40:00Z,,-0.2023,0.6,0.04062600173170316,0.009722208474413881
Yahoo Entertainment,https://finance.yahoo.com/news/dell-14-87x-p-e-180000142.html,DELL at 14.87X P/E is Trading Dirt Cheap: Right Time to Buy the Stock?,2025-11-07T18:00:00Z,,0.7783,0.6,0.032871739699102225,0.017536744412074045
Yahoo Entertainment,https://finance.yahoo.com/news/microsoft-msft-q3-results-reflect-072624476.html,Microsoft (MSFT)’s Q3 Results Reflect Both the Promise and the Cost of Its AI-Driven Cloud Expansion,2025-11-07T07:26:24Z,MSFT,0.7351,0.6,0.01786143236824938,0.00929741139064485
Barchart.com,https://www.barchart.com/story/news/35967629/analysts-say-we-would-be-aggressive-buyers-on-any-pullbacks-in-microsoft-stock-should-you-be-too,Analysts Say ‘We Would Be Aggressive Buyers on Any Pullbacks’ in Microsoft Stock. Should You Be Too?,2025-11-06T21:27:48Z,MSFT,0.6553,0.6,0.010037909695260937,0.004984725575569628
TheStreet,https://www.thestreet.com/crypto/stock/microsoft-backed-stock-drops-ahead-of-4-pm-earnings,Microsoft-backed crypto stock drops ahead of 5 PM earnings,2025-11-06T20:40:27Z,MSFT,-0.4215,0.6,0.009590613293471472,0.0016644509370819741
BeInCrypto,https://beincrypto.com/bitcoin-declines-leave-major-crypto-treasuries-reeling/,Bitcoin Treasuries Face Capital Shock as Falling Prices Erase Gains,2025-11-08T14:48:30Z,,0.296,0.6,0.1093495610273524,0.04251510932743461
Cryptonews,https://cryptonews.com/news/crypto-treasuries-take-a-hit-as-month-long-market-slump-erodes-balance-sheets/,Crypto Treasuries Take a Hit as Month-Long Market Slump Erodes Balance Sheets,2025-11-08T10:15:00Z,,0.7184,0.6,0.08403640272650637,0.04332244633356856
TheStreet,https://www.thestreet.com/crypto/technology/cathie-wood-bitmine-stock,Cathie Wood buys more of Wall Street veteran's stock,2025-11-07T22:28:22Z,,0.7217,0.6,0.042562391556295175,0.02198390086274202
Cointelegraph,https://cointelegraph.com/news/evernorth-xrp-losses-digital-asset-treasury-risks-cryptoquant,Evernorth’s unrealized XRP losses expose mounting pressure on DATs: CryptoQuant,2025-11-07T22:09:17Z,,-0.11,0.6,0.0417875906803549,0.011157286711654758
Yahoo Entertainment,https://finance.yahoo.com/news/michael-saylors-bitcoin-plan-cost-213116908.html,Michael Saylor's Bitcoin Plan Has A Cost — Strategy Must Pay $689M Just To HODL,2025-11-07T21:31:16Z,MSTR,0.1027,0.6,0.04028586270339296,0.013326966240909425
TheStreet,https://www.thestreet.com/crypto/trading/major-crypto-stocks-reel-after-devastating-sell-off,Major crypto stocks reel after devastating sell-off,2025-11-07T19:33:57Z,,-0.6486,0.6,0.035983457924566885,0.0037933761344078414
GlobeNewswire,https://www.globenewswire.com/news-release/2025/11/07/3183914/0/en/Clear-Street-s-Disruptive-Technology-Conference-Convenes-this-Month-in-Palm-Beach.html,Clear Street’s Disruptive Technology Conference Convenes this Month in Palm Beach,2025-11-07T19:30:00Z,,0.6249,0.6,0.03584688398998109,0.017474280538596083
BeInCrypto,https://beincrypto.com/microstrategy-bitcoin-purchase-stock-price-falls/,Michael Saylor Isn’t Backing Down — Even as Bitcoin and MSTR Sink,2025-11-07T18:44:39Z,MSTR,0.6369,0.6,0.034315529160310304,0.01685132690475358
Biztoc.com,https://biztoc.com/x/e6756e6c38a64733,Warren Buffett vs. Michael Saylor: Who Made the Better Investment This Quarter,2025-11-07T17:21:51Z,MSTR,0.6705,0.6,0.03168635232727337,0.015879615468813047
Biztoc.com,https://biztoc.com/x/bfc93d0bbaff8470,MSTR Falls To $230 Despite Strategy's Upsized Stock Offering,2025-11-07T15:43:27Z,MSTR,0.8481,0.6,0.028822488599276195,0.0159800523540967
Biztoc.com,https://biztoc.com/x/4fa3573f7ef19ae9,2x and -2x MSTR ETF investors are getting hammered with 65% losses. Here's why and what to know,2025-11-07T15:00:01Z,MSTR,-0.836,0.6,0.02764216902615093,0.001359994716086626
TheStreet,https://www.thestreet.com/investing/2x-and-2x-mstr-etf-investors-are-getting-hammered-with-65-losses-heres-why-and-what-to-know,2x and -2x MSTR ETF investors are getting hammered with 65% losses. Here's why and what to know.,2025-11-07T14:37:00Z,MSTR,-0.8555,0.6,0.02703640307058934,0.0011720280731100476
BeInCrypto,https://beincrypto.com/warren-buffet-inspired-bitcoin-strategy-us-crypto-news/,Warren Buffett-Inspired Strategy Drives Canadian Bitcoin Treasury Growth | US Crypto News,2025-11-07T14:33:54Z,,0.8173,0.6,0.026955836257929487,0.014696052369460576
CoinDesk,https://www.coindesk.com/markets/2025/11/07/strategy-adds-europe-to-capital-raising-efforts-securing-usd715m-in-newest-preferred-offering,"Strategy Adds Europe to Capital Raising Efforts, Securing $715M in Newest Preferred Offering",2025-11-07T14:12:45Z,MSTR,0.3182,0.6,0.026412532995479358,0.010445100298392266
Decrypt,https://decrypt.co/347810/morning-minute-fomos-17m-raise-and-the-rise-of-the-everything-apps,Morning Minute: Fomo's $17M Raise and The Rise of the 'Everything Apps',2025-11-07T13:30:49Z,,0.4767,0.6,0.0253675100829478,0.011238060641846705
CoinDesk,https://www.coindesk.com/daybook-us/2025/11/07/risk-assets-lose-appeal-crypto-daybook-americas,Risk Assets Lose Appeal: Crypto Daybook Americas,2025-11-07T12:15:00Z,,-0.4767,0.6,0.023581916855009964,0.003702125127068014
Biztoc.com,https://biztoc.com/x/4f5a81ccd13f1a0f,2x and -2x MSTR ETF investors are getting hammered with 65% losses. Here's why and what to know,2025-11-07T11:42:42Z,MSTR,-0.836,0.6,0.022859912394414022,0.00112470768980517
Yahoo Entertainment,https://finance.yahoo.com/news/1-wall-street-favorite-stock-043640363.html,1 of Wall Street’s Favorite Stock to Own for Decades and 2 We Avoid,2025-11-07T04:36:40Z,,0.1027,0.6,0.015168799461834335,0.005017990549969416
Biztoc.com,https://biztoc.com/x/5fa22ece397df312,Michael Burry Returns to Target AI Tech Bubble Pinups Nvidia (NVDA) and Palantir (PLTR),2025-11-08T15:05:13Z,NVDA,0.0,0.6,0.11112357478415091,0.03333707243524527
Yahoo Entertainment,https://finance.yahoo.com/news/forget-nvidia-nvda-american-politicians-144925219.html,Forget Nvidia (NVDA) – American Politicians Are Buying This Small AI Stock,2025-11-08T14:49:25Z,NVDA,0.9509,0.6,0.10944609395316995,0.06405551540797177
Pypi.org,https://pypi.org/project/usdk/,usdk added to PyPI,2025-11-08T10:10:12Z,,0.0,0.6,0.08364896137174192,0.025094688411522577
Yahoo Entertainment,https://finance.yahoo.com/news/nvidia-ceo-huang-sees-strong-041748560.html,Nvidia CEO Huang sees strong demand for Blackwell chips,2025-11-08T04:17:48Z,NVDA,0.8141,0.6,0.05958309964604003,0.03242691032036436
Biztoc.com,https://biztoc.com/x/9951892a56c816e0,Big Tech Companies Just Delivered Incredible News for Nvidia Investors,2025-11-08T04:09:39Z,NVDA,0.9382,0.6,0.05911743715461699,0.03437442500792359
Biztoc.com,https://biztoc.com/x/9426271a1bde0779,Billionaire Ray Dalio Is Loading Up On These 2 ETFs and 1 Stock,2025-11-08T00:38:31Z,"NVDA,SPY",0.765,0.6,0.04824378105006034,0.025545082066006947
Raw Story,https://www.rawstory.com/nasdaq/,"'Thanks, Donald!' Observers in awe as stocks see worst week since Trump's 'Liberation Day'",2025-11-07T22:23:03Z,NVDA,-0.8908,0.6,0.04234509383632643,0.0013872252740780536
Biztoc.com,https://biztoc.com/x/6c10e7e9942cc5c5,Big News Is Coming for Nvidia Investors on Nov. 19. Should You Buy Nvidia Stock Now?,2025-11-07T21:25:17Z,NVDA,0.6486,0.6,0.04005447224366915,0.01981014088227389
The Times of India,https://economictimes.indiatimes.com/news/international/us/nvidia-stock-down-today-as-the-ai-giant-faces-its-sharpest-crash-of-2025-why-is-nvda-crashing-so-sharply-this-week-as-800-billion-in-value-vanishes-has-the-ai-boom-finally-reached-its-breaking-point/articleshow/125168903.cms,Nvidia stock down today as the AI giant faces its sharpest crash of 2025: Why is NVDA crashing so sharply this week as $800 billion in value vanishes?,2025-11-07T18:27:55Z,NVDA,0.5106,0.6,0.03376715714200451,0.015302600273613605
Yahoo Entertainment,https://finance.yahoo.com/news/top-founder-led-companies-safer-182100105.html,Top Founder-Led Companies That Can Be Safer Long-Term Bets,2025-11-07T18:21:00Z,,0.9716,0.6,0.03354305836159275,0.01984004815971488
Yahoo Entertainment,https://finance.yahoo.com/news/why-nvidia-nvda-stock-falling-181100638.html,Why Nvidia (NVDA) Stock Is Falling Today,2025-11-07T18:11:00Z,NVDA,0.4215,0.6,0.03322168718382983,0.014167388499544232
Barchart.com,https://www.barchart.com/story/news/35990786/amid-softbank-takeover-rumors-should-you-buy-sell-or-hold-marvell-stock,"Amid SoftBank Takeover Rumors, Should You Buy, Sell, or Hold Marvell Stock?",2025-11-07T18:00:17Z,,0.2023,0.6,0.03288070155556701,0.011859740244077462
The Times of India,https://economictimes.indiatimes.com/news/international/us/whats-really-going-on-nvidias-500-billion-meltdown-did-jensen-huangs-china-comments-cross-a-red-line/articleshow/125167512.cms,What’s really going on? Nvidia’s $500 billion meltdown - did Jensen Huang’s China comments cross a red line?,2025-11-07T17:30:21Z,NVDA,0.5362,0.6,0.031946701681656496,0.014722956937008213
Whitecoatinvestor.com,https://www.whitecoatinvestor.com/separately-managed-accounts/,Separately Managed Accounts (SMAs): Are They Worth Your Money?,2025-11-08T07:30:18Z,,0.8233,0.6,0.07171446802825703,0.039227096866776306
Biztoc.com,https://biztoc.com/x/205c7f1339a861b4,Stocks Recover on Government Reopening Hopes,2025-11-07T21:45:59Z,"QQQ,SPY",0.4215,0.6,0.04086068174190533,0.017425037728835528
Rolling Out,https://rollingout.com/2025/11/07/invesco-qqq-trading-down-stock-market/,Invesco QQQ drops to $611 amid heavy sell-off Thursday,2025-11-07T20:28:00Z,QQQ,0.4122,0.6,0.03790539190660379,0.016058998335151762
Biztoc.com,https://biztoc.com/x/5241aa624f155773,Unusual QQQ Options Activity Prompts Covered Strangle Thought Experiment,2025-11-07T18:37:53Z,QQQ,-0.743,0.6,0.03409270956089177,0.0026285479071447553
Barchart.com,https://www.barchart.com/story/news/35991315/unusual-qqq-options-activity-prompts-covered-strangle-thought-experiment,Unusual QQQ Options Activity Prompts Covered Strangle Thought Experiment,2025-11-07T18:30:02Z,QQQ,0.4243,0.6,0.03383603412228701,0.014457799020112015
Biztoc.com,https://biztoc.com/x/d056c218bbf656af,Economic Angst Weighs on Stocks,2025-11-07T16:27:13Z,"QQQ,SPY",0.0,0.6,0.03006284979602901,0.009018854938808702
Biztoc.com,https://biztoc.com/x/291ae32a30454f6d,"Stock Market News Review: SPY, QQQ Blindsided by Alarming Layoffs Data as VIX Surges",2025-11-07T14:48:40Z,"QQQ,SPY",-0.2263,0.6,0.027341772511658407,0.006346298817681033
Thefly.com,https://thefly.com/permalinks/entry.php/id4234491/QQQ-Invesco-QQQ-Trust-Pivot-points,Invesco QQQ Trust: Pivot points,2025-11-07T13:20:02Z,QQQ,0.8442,0.6,0.02510552540714167,0.013889882986755201
Biztoc.com,https://biztoc.com/x/c8bf0e8e90fe07c5,Stocks Slide on Signs of a Cooling Labor Market,2025-11-06T21:40:53Z,"QQQ,SPY",0.0,0.6,0.010165138801632275,0.0030495416404896824
Barchart.com,https://www.barchart.com/story/news/35967875/stocks-slide-on-signs-of-a-cooling-labor-market,Stocks Slide on Signs of a Cooling Labor Market,2025-11-06T21:32:46Z,"QQQ,SPY",0.0,0.6,0.010086018414988903,0.003025805524496671
TheStreet,https://www.thestreet.com/investing/qqq-considered-best-tech-etf-but-numbers-say-otherwise,"QQQ considered best tech ETF, but numbers say otherwise",2025-11-06T19:03:00Z,QQQ,0.8555,0.6,0.008731778879370537,0.004860544713201609
Biztoc.com,https://biztoc.com/x/065caaaed36035ef,"QQQ considered best tech ETF, but numbers say otherwise",2025-11-06T16:11:06Z,QQQ,0.8873,0.6,0.007400001644740648,0.004189806931235707
Barchart.com,https://www.barchart.com/story/news/35958974/stocks-slide-on-bleak-us-job-news-and-weakness-in-chipmakers,Stocks Slide on Bleak US Job News and Weakness in Chipmakers,2025-11-06T16:10:43Z,"QQQ,SPY",-0.4215,0.6,0.007397271261007229,0.0012837964273478047
Barchart.com,https://www.barchart.com/story/news/35956961/signs-of-us-labor-market-weakness-weigh-on-stocks,Signs of US Labor Market Weakness Weigh on Stocks,2025-11-06T15:02:18Z,"QQQ,SPY",-0.4215,0.6,0.006925748649163222,0.0012019636780622772
Thefly.com,https://thefly.com/permalinks/entry.php/id4232626/QQQ-Invesco-QQQ-Trust-Pivot-points,Invesco QQQ Trust: Pivot points,2025-11-06T13:20:02Z,QQQ,0.8442,0.6,0.006276381251886061,0.003472470691418482
Biztoc.com,https://biztoc.com/x/fb5c0dcc2fdbed1a,QQQ Vs. IGV: NDX's Simplicity Still Wins; Software ETFs Not Yet Core In Current Markets,2025-11-06T08:40:11Z,QQQ,0.9062,0.6,0.004794074829683867,0.0027415396321030165
Etf.com,http://www.etf.com/sections/daily-etf-flows/daily-etf-flows-vgt-sheds-16b?utm_source=yahoo-finance&amp;utm_medium=rss&amp;utm_campaign=yahoo-finance-rss,Daily ETF Flows: VGT Sheds $1.6B,2025-11-05T23:00:05Z,,0.5267,0.6,0.0027426261505820245,0.001256150203228073
Barchart.com,https://www.barchart.com/story/news/35933538/stocks-rally-on-positive-us-economic-news-and-strength-in-chipmakers,Stocks Rally on Positive US Economic News and Strength in Chipmakers,2025-11-05T21:31:31Z,"QQQ,SPY",0.7783,0.6,0.0025184720455525863,0.0013435796515818494
Biztoc.com,https://biztoc.com/x/55a369e5fc488783,Stocks Rebound on Economic Optimism,2025-11-05T16:31:55Z,"QQQ,SPY",0.5423,0.6,0.0018874489217810101,0.0008733037416188556
Barchart.com,https://www.barchart.com/story/news/35925804/stocks-rebound-on-economic-optimism,Stocks Rebound on Economic Optimism,2025-11-05T16:21:49Z,"QQQ,SPY",0.5423,0.6,0.0018691855923234938,0.0008648534817121573
Americanthinker.com,https://www.americanthinker.com/articles/2025/11/if_this_isn_t_an_emergency_what_is.html,"If This Isn’t an Emergency, What Is?",2025-11-09T05:00:00Z,,0.9001,0.6,0.2482142655676915,0.1414895778015512
CBS News,https://www.cbsnews.com/news/han-family-murders-santa-barbara-california-pierre-haobsh-48-hours/,"Suspect in Calif. family's murder asked online psychic: ""will I get caught?""",2025-11-09T03:59:02Z,,-0.9081,0.6,0.23406514267850007,0.006453175983646245
Screen Rant,https://screenrant.com/best-anime-no-one-hates-clout-list/,"If You Hate These 10 Anime, You’re Straight-Up Lying",2025-11-09T03:00:31Z,,0.128,0.6,0.22124378797848568,0.07486889785191957
Israelnationalnews.com,https://www.israelnationalnews.com/news/417489,Houthis claim CIA-Mossad spy network arrested in Yemen,2025-11-09T02:17:14Z,SPY,-0.4588,0.6,0.2122142009585606,0.034455097667631905
New Zealand Herald,https://www.nzherald.co.nz/nz/politics/government-unveils-major-meth-action-plan-to-tackle-organised-crime/GCB427OIENHL3EJGWPNU4DFMDE/,Government unveils major meth action plan to tackle organised crime,2025-11-09T01:19:42Z,,-0.6908,0.6,0.20077975263548148,0.018624329854467263
Ozbargain.com.au,https://www.ozbargain.com.au/node/932155,[Android] Free Spy Camera Network Scanner PRO $0 (Was $2.39) @ Google Play Store,2025-11-09T00:43:22Z,SPY,0.6846,0.6,0.1938782307394249,0.09798218025109057
Just Jared,https://www.justjared.com/2025/11/08/the-mcbee-dynastys-cole-mcbee-kacie-adkison-engaged-nearly-1-year-after-welcoming-daughter/,"The McBee Dynasty's Cole McBee & Kacie Adkison Engaged, Nearly 1 Year After Welcoming Daughter",2025-11-09T00:22:16Z,,0.9115,0.6,0.18997969869874595,0.10894385821879587
Hoover.org,https://www.hoover.org/research/articles-trade-tourism-china-spy-case-corruption-surveillance-sanctions-g2-europe-ai-chips,"Articles On: Trade, Tourism, China Spy Case, Corruption, Surveillance, Sanctions, G2, Europe, AI Chips, Fentanyl, Bio-Smuggling Case, and CCTV",2025-11-09T00:00:00Z,SPY,0.6249,0.6,0.18595059055523017,0.09064533437795805
Webupon.com,https://webupon.com/blog/best-link-building-tools/,Top Link Building Tools for Effective SEO Strategy,2025-11-08T22:17:28Z,,0.9423,0.6,0.16847235978654168,0.09816715932401995
ComicBook.com,http://comicbook.com/movies/feature/one-of-the-mcus-most-powerful-characters-ever-only-appeared-once-will-probably-never-return/,One of the MCU’s Most Powerful Characters Ever Only Appeared Once (& Will Probably Never Return),2025-11-08T21:30:00Z,,0.9715,0.6,0.16094703298250593,0.09519212265750314
Yahoo Entertainment,https://www.yahoo.com/news/articles/authorities-stunned-discovering-high-tech-190000538.html,Authorities stunned after discovering high-tech secret compartments at retail store: 'Blatant disregard for the law',2025-11-08T19:00:00Z,,-0.5095,0.6,0.13930554109878046,0.020498810372685545
TechRadar,https://www.techradar.com/gaming/nyt-connections-today-answers-hints-9-november-2025,"NYT Connections hints and answers for Sunday, November 9 (game #882)",2025-11-08T15:30:00Z,,0.8478,0.6,0.11380673777641134,0.06308762701897586
Bleeding Cool News,https://bleedingcool.com/movies/jamie-lee-curtis-shares-her-stance-on-a-true-lies-sequel/,Jamie Lee Curtis Shares Her Stance on a True Lies Sequel,2025-11-08T14:18:03Z,,0.128,0.6,0.1061905518045324,0.03593488273065377
Screen Rant,https://screenrant.com/alita-battle-angel-cast-edward-norton-sequel-not-happened/,This Underrated $405 Million Sci-Fi Movie Cast A Big-Name Actor For A Sequel That Hasn't Happened Yet,2025-11-08T14:15:19Z,,0.7845,0.6,0.10591148984019765,0.05669971608594981
The Daily Caller,https://dailycaller.com/2025/11/08/barack-obama-judge-greenlit-secret-subpoenas-targeting-gop-ethics-complaint/,EXCLUSIVE: Obama Judge Who Greenlit Secret Subpoenas Targeting GOP Hit With Ethics Complaint,2025-11-08T13:51:01Z,,-0.5813,0.6,0.10346258231082645,0.012995934964062907
Moneydigest.com,https://www.moneydigest.com/2015130/might-be-upper-class-portfolio/,You Might Be Considered 'Upper Class' If Your Portfolio Looks Like This,2025-11-08T13:30:00Z,,0.7003,0.6,0.1013902753138302,0.05171816553483164
CNBC,https://www.cnbc.com/2025/11/08/big-tech-ai-underwater-cables.html,Underwater cables are a vital piece of the AI buildout and internet — investment is booming,2025-11-08T13:00:01Z,META,0.4404,0.6,0.09850547126910829,0.04256618424480707
Rolling Stone,http://www.rollingstone.com/tv-movies/tv-movie-features/patriot-spy-series-amazon-1235459206/,"Inside ‘Patriot,’ the Cult-Favorite Spy Caper You Should Be Watching",2025-11-08T13:00:00Z,SPY,0.9042,0.6,0.09850389042234373,0.056271332442668076
Electrek,http://electrek.co/2025/11/08/schrodingers-fsd-when-things-go-well-teslas-driving-when-they-dont-you-are/,"Schrödinger’s FSD: When it works well, Tesla is driving. When it doesn’t, you are.",2025-11-08T13:00:00Z,,0.9349,0.6,0.09850388981543087,0.05717855292116315
CNET,https://www.cnet.com/home/security/steps-to-spot-any-hidden-camera-in-your-next-airbnb/,7 Steps to Spot Any Hidden Camera in Your Next Airbnb,2025-11-08T13:00:00Z,SPY,-0.2705,0.6,0.09850388955464802,0.02155757622903472
CleanTechnica,https://cleantechnica.com/2025/11/08/could-you-drive-an-older-used-tesla-model-3-for-half-the-cost-of-a-newer-used-honda-civic/,Could You Drive An Older Used Tesla Model 3 For Half The Cost Of A Newer Used Honda Civic?,2025-11-08T22:45:33Z,,0.4019,0.6,0.17308929268978035,0.07279616382654092
KHOU.com,https://www.khou.com/article/money/business/houston-business-journal/tesla-houston-area-factory-hiring/285-90196b25-ee26-4632-8301-21b8590d1985,Tesla begins hiring for workers at its new $200M Houston-area manufacturing plant,2025-11-08T17:39:00Z,TSLA,0.0,0.6,0.12885536366029865,0.038656609098089594
Mutualfundobserver.com,https://www.mutualfundobserver.com/2025/11/briefly-noted-109/,Briefly Noted . . .,2025-11-08T16:58:24Z,AMD,0.7639,0.6,0.12391610478769857,0.06557268517050646
Yahoo Entertainment,https://finance.yahoo.com/news/american-politicians-buying-tesla-tsla-154930048.html,These American Politicians Are Buying Tesla (TSLA),2025-11-08T15:49:30Z,TSLA,0.9571,0.6,0.11596337692184618,0.06808557749212354
Biztoc.com,https://biztoc.com/x/298364a114635f20,"TSLA, PLTR, IREN And More: 5 Stocks That Dominated Investor Buzz This Week",2025-11-08T15:16:26Z,TSLA,0.0,0.6,0.11233000331167574,0.03369900099350272
Yahoo Entertainment,https://finance.yahoo.com/news/tesla-musk-sees-fsd-winning-110513090.html,Tesla’s Musk sees FSD winning full China approval in early 2026,2025-11-08T11:05:13Z,TSLA,0.9412,0.6,0.08819882132724308,0.051363465588133275
Investopedia,https://www.investopedia.com/s-and-p-500-gains-and-losses-today-take-two-stock-falls-expedia-soars-on-resilient-travel-demand-11846070,S&P 500 Gains and Losses Today: Take-Two Stock Falls; Expedia Soars on Resilient Travel Demand,2025-11-07T21:31:11Z,,0.0772,0.6,0.04028261970774853,0.013017731384756013
Investopedia,https://www.investopedia.com/elon-musk-got-his-usd1-trillion-pay-package-now-tesla-s-moonshot-goals-are-in-focus-11845843,Elon Musk Got His $1 Trillion Pay Package. Now Tesla's Moonshot Goals Are In Focus.,2025-11-07T20:46:58Z,,0.7184,0.6,0.03860386944561799,0.019901066776604987
Biztoc.com,https://biztoc.com/x/14e54ba870a1fb49,"Tesla Is Falling Behind in the European EV Race. Should You Buy, Sell, or Hold TSLA Stock Before It Accelerates Again?",2025-11-07T19:21:21Z,TSLA,-0.6597,0.6,0.0355496021927643,0.0036292588878593076
Barchart.com,https://www.barchart.com/story/news/35992460/tesla-is-falling-behind-in-the-european-ev-race-should-you-buy-sell-or-hold-tsla-stock-before-it-accelerates-again,"Tesla Is Falling Behind in the European EV Race. Should You Buy, Sell, or Hold TSLA Stock Before It Accelerates Again?",2025-11-07T19:17:27Z,TSLA,0.1531,0.6,0.03541637964742372,0.012251588211433287
Electrek,http://electrek.co/2025/11/07/tesla-tsla-down-5-on-news-its-stuck-with-its-bad-ceo-musk-for-10-more-years/,Tesla (TSLA) down 5% on news it’s stuck with its bad CEO Musk for 10 more years,2025-11-07T17:21:04Z,TSLA,0.0516,0.6,0.0316624569912418,0.009988871931596964
