source,url,title,published_at,tickers,sentiment,trust,recency,score
Yahoo Entertainment,https://finance.yahoo.com/news/3-mega-cap-stocks-concern-043311570.html,3 Mega-Cap Stocks That Concern Us,2025-11-10T04:33:11Z,,-0.9053,0.6,0.23203198341110368,0.006592028648709456
Github.com,https://github.com/diet103/claude-code-infrastructure-showcase,"GitHub - diet103/claude-code-infrastructure-showcase: Examples of my Claude Code infrastructure with skill auto-activation, hooks, and agents",2025-11-10T05:47:01Z,,0.0,0.6,0.24912499681962416,0.07473749904588725
Christopherbiscardi.com,https://christopherbiscardi.com/i-use-typst-now,I use Typst now,2025-11-10T05:47:01Z,,0.0,0.6,0.2491249965558071,0.07473749896674213
Okayfail.com,https://okayfail.com/2025/in-praise-of-dhh.html,In Praise of dhh,2025-11-10T05:47:01Z,,0.8641,0.6,0.2491249960321701,0.13931817153107048
New Atlas,https://newatlas.com/adhd-autism/low-concern-tylenol-adhd-or-autism/,"No credible tie between Tylenol use and autism/ADHD, huge study finds",2025-11-10T05:03:00Z,,-0.4767,0.6,0.2387888559538914,0.03748746249620141
Digiday,http://digiday.com/marketing/brands-and-influencers-are-not-including-intellectual-property-clauses-addressing-ai-in-their-deals/,Brands and influencers are not including intellectual property clauses addressing AI in their deals,2025-11-10T05:01:00Z,,-0.2268,0.6,0.23832953139321422,0.05528291810196997
Digiday,http://digiday.com/marketing/ride-hailing-app-puts-social-justice-in-drive/,Ride-hailing app puts social justice in drive,2025-11-10T05:01:00Z,,0.7783,0.6,0.23832953096110057,0.12714642147243754
EURACTIV,https://www.euractiv.com/news/eus-red-tape-bonfire-puts-ai-ahead-of-privacy-protection/,EU’s red tape bonfire puts AI ahead of privacy protection,2025-11-10T05:00:10Z,,-0.1691,0.6,0.23813840610567658,0.059360760489962
Yahoo Entertainment,https://finance.yahoo.com/news/3-growth-stocks-explosive-upside-043547498.html,3 Growth Stocks with Explosive Upside,2025-11-10T04:35:47Z,,0.9136,0.6,0.23261345800436797,0.13353873397114754
Cointelegraph,https://cointelegraph.com/news/bitcoin-treasury-bear-market-may-end-mstr-short-seller,Bitcoin treasury bear market tipped to end as short seller backs off MSTR,2025-11-10T04:38:56Z,MSTR,0.0772,0.6,0.23331990974062372,0.07539966203177995
Economictimes.com,https://m.economictimes.com/news/india/from-maharani-4-to-the-family-man-3-hottest-web-series-making-a-comeback/the-ott-comeback-season/slideshow/125215754.cms,From Maharani 4 to The Family Man 3: Hottest web series making a comeback!,2025-11-10T05:46:30Z,,0.9651,0.6,0.24900104155314992,0.14679358402682846
Independent.ie,https://www.independent.ie/world-news/middle-east/hamas-hands-over-the-body-of-israeli-soldier-held-since-2014/a1749638894.html,Hamas hands over the body of Israeli soldier held since 2014,2025-11-10T05:30:00Z,,-0.9169,0.6,0.24507700178619968,0.006109769654529954
WWD,http://wwd.com/business-news/business-features/the-north-face-caroline-brown-building-outdoors-brand-vf-corp-1238334304/,The North Face’s Caroline Brown on Building a Global Outdoors Brand,2025-11-10T05:01:00Z,SPY,0.5994,0.6,0.23832946518040585,0.11435524398286234
Intelnews.org,https://intelnews.org/2025/11/10/01-3417/,"British spy and his Chinese handler used private jet to escape to China, report claims",2025-11-10T05:01:00Z,SPY,-0.6369,0.6,0.2383294643085307,0.025961228547128245
Globalsecurity.org,https://www.globalsecurity.org/intell/library/news/2025/intell-251109-presstv02.htm,US-Israeli-Saudi spy network sought to end Yemen's support for Palestine: Top Yemeni official,2025-11-10T04:44:28Z,SPY,0.975,0.6,0.23456607144411754,0.13898039733063963
Globalsecurity.org,https://www.globalsecurity.org/wmd/library/news/taiwan/2025/taiwan-251109-cna03.htm,MAC condemns KMT chair for attending controversial White Terror memorial,2025-11-10T04:44:21Z,SPY,-0.9493,0.6,0.2345397266676375,0.003567349242614764
The Times of India,https://timesofindia.indiatimes.com/life-style/health-fitness/diet/vitamin-e-and-eye-health-8-best-foods-to-eat-for-stronger-vision-and-long-term-protection/photostory/125216772.cms,8 best foods to eat for stronger vision and long-term protection,2025-11-10T06:54:00Z,AMD,0.9403,0.6,0.24445694748933117,0.14229594456406477
Notebookcheck.net,https://www.notebookcheck.net/Tuxedo-intros-InfinityBook-Max-15-Gen-10-with-up-to-AMD-Strix-Point-and-Nvidia-RTX-5070.1159365.0.html,Tuxedo intros InfinityBook Max 15 Gen 10 with up to AMD Strix Point and Nvidia RTX 5070,2025-11-10T06:47:00Z,AMD,0.0,0.6,0.24281510594520264,0.07284453178356079
Slickdeals.net,https://slickdeals.net/f/18787480-lenovo-ideapad-slim-3-15-6-fhd-ips-touch-ryzen-7-5825u-16gb-ddr4-512gb-ssd-399-99,"Lenovo IdeaPad Slim 3: 15.6"" FHD IPS Touch, Ryzen 7 5825U, 16GB DDR4 512GB SSD $399.99 (2 replies)",2025-11-10T06:24:11Z,AMD,0.8658,0.6,0.23753965099834154,0.1329604442498117
Slickdeals.net,https://slickdeals.net/f/18787441-asus-rog-flow-z13-13-4-2-5k-180hz-touch-ryzen-ai-max-395-64gb-lpddr5-1tb-ssd-1999-99,"ASUS ROG Flow Z13: 13.4"" 2.5K 180Hz Touch, Ryzen AI Max+ 395, 64GB LPDDR5, 1TB SSD $1999.99 (2 replies)",2025-11-10T06:15:10Z,AMD,0.9287,0.6,0.2354866365714525,0.1362549227866081
Slickdeals.net,https://slickdeals.net/f/18787420-hp-omen-35l-gaming-desktop-ryzen-5-8400f-rtx-5060-16gb-ddr5-1tb-ssd-879-99,"HP OMEN 35L Gaming Desktop: Ryzen 5 8400F, RTX 5060, 16GB DDR5, 1TB SSD $879.99",2025-11-10T06:11:40Z,AMD,0.9287,0.6,0.23469450662429062,0.1357965884778808
Vogue,https://www.vogue.com/article/is-fashion-ready-for-the-ai-bubble-to-burst,Is Fashion Ready for the AI Bubble to Burst?,2025-11-10T06:07:43Z,,-0.4696,0.6,0.2338037317213683,0.03720284979150412
Hospitality Net,https://www.hospitalitynet.org/opinion/4129535.html,Welltech Leaders and the Evolution of Personalized Multimodal Guest Experiences,2025-11-10T07:06:00Z,,0.891,0.6,0.24729737469298632,0.14029180066333113
GlobeNewswire,https://www.globenewswire.com/news-release/2025/11/10/3184200/0/en/Halper-AI-Launches-to-Transform-the-Future-of-SMEs-From-Digital-Souls-to-Business-Growth.html,Halper AI Launches to Transform the Future of SMEs From Digital Souls to Business Growth,2025-11-10T06:44:00Z,,0.836,0.6,0.24211481490641737,0.13335684005045467
MarketWatch,https://www.marketwatch.com/story/the-bull-market-in-stocks-and-the-buy-everything-rally-now-feel-like-an-uphill-battle-a4352bb0,"The ‘buy everything’ rally now feels like an uphill battle, putting bull market to the test",2025-11-09T20:31:00Z,,-0.6497,0.6,0.1341923448106893,0.014102273516155336
Geeky Gadgets,https://www.geeky-gadgets.com/oakley-vanguard-vs-ray-ban-meta-gen-2-comparison-review/,Oakley Vanguard vs Ray-Ban Meta Gen 2 : Which Smart Glasses Are Best For You?,2025-11-10T07:11:32Z,META,0.9161,0.6,0.24861819907602406,0.14291319937487093
Marketing Week,https://www.marketingweek.com/isba-director-general-simon-michaelides/,"‘Eternally curious’: ISBA’s new director general on transformation, AI and diversifying membership",2025-11-10T06:29:45Z,,0.25,0.6,0.23881599963544903,0.08955599986329338
Hurriyet Daily News,https://www.hurriyetdailynews.com/artificial-intelligence-revolution-has-a-power-problem-215556,Artificial Intelligence revolution has a power problem,2025-11-10T06:08:39Z,,-0.5719,0.6,0.23401385238548,0.0300543990618672
The Week Magazine,https://theweek.com/culture-life/travel/washington-dc-tourism-government-shutdown,DC tourism has taken a hit,2025-11-10T07:00:00Z,,0.4767,0.6,0.24587292848130363,0.10892416604650232
Sciencebasedmedicine.org,https://sciencebasedmedicine.org/antivaxxer-steve-kirsch-unknowingly-identifies-the-fatal-flaw-of-an-antivax-report-from-the-mccullough-foundation/,Antivaxxer Steve Kirsch unknowingly identifies the fatal flaw of an antivax “report” from the McCullough Foundation,2025-11-10T08:14:00Z,,-0.5423,0.6,0.23754277289223547,0.03261699814583285
pymnts.com,https://www.pymnts.com/smbs/2025/58-percent-of-smbs-turn-to-embedded-finance-for-cash-flow-management/,58% of SMBs Turn to Embedded Finance for Cash Flow Management,2025-11-10T09:00:52Z,,-0.2023,0.6,0.24850584962299965,0.05946993487328004
Pypi.org,https://pypi.org/project/odoo-addon-crm-stage-mail/16.0.1.0.0.2/,odoo-addon-crm-stage-mail 16.0.1.0.0.2,2025-11-10T08:05:37Z,CRM,0.3182,0.6,0.2356333428128799,0.09318356174878148
Pypi.org,https://pypi.org/project/odoo-addon-crm-stage-mail/,odoo-addon-crm-stage-mail added to PyPI,2025-11-10T08:05:37Z,CRM,0.3182,0.6,0.23563334254822715,0.0931835616441219
Pypi.org,https://pypi.org/project/nvidia-nat-profiling/1.3.0a20251110/,nvidia-nat-profiling 1.3.0a20251110,2025-11-10T09:05:12Z,META,0.3182,0.6,0.2495446882993913,0.09868494243487728
pymnts.com,https://www.pymnts.com/opinion/david-s-evans/2025/the-4-5-quadrillion-opportunity-in-human-time/,The $4.5 Quadrillion Opportunity in Human Time,2025-11-10T09:00:49Z,,0.9748,0.6,0.24849386363383613,0.14721770457122987
pymnts.com,https://www.pymnts.com/connectedeconomy/2025/strong-showings-from-affirm-and-fis-cant-stop-ce-100-slide/,Strong Showings From Affirm and FIS Can’t Stop CE 100 Slide,2025-11-10T09:00:41Z,,0.6486,0.6,0.24846196812866597,0.12288432019707562
Adweek,https://www.adweek.com/creativity/yahoo-dsp-ctv-ad-campaign-troy-hawke-conscious-minds/,"Yahoo DSP Airs First-Ever CTV Ad Campaign, Starring Troy Hawke",2025-11-10T09:00:00Z,,0.4939,0.6,0.24829857112831483,0.11127997062257686
CoinDesk,https://www.coindesk.com/markets/2025/11/10/circle-coreweave-earnings-square-s-bitcoin-payments-crypto-week-ahead,"Circle, CoreWeave Earnings, Square's Bitcoin Payments: Crypto Week Ahead",2025-11-10T09:00:00Z,,0.5267,0.6,0.24829857070999797,0.11372322837088616
Verdict,https://www.verdict.co.uk/meta-invest-600bn-ai-data-centres/,Meta to invest $600bn in AI data centres and infrastructure,2025-11-10T08:55:44Z,META,0.3182,0.6,0.24728076607432511,0.09778965175175261
Digitimes,https://www.digitimes.com/news/a20251110PD228/revenue-startup-advertising-growth-2026.html,Snapchat drops US$400 million on Perplexity to integrate AI search,2025-11-10T08:50:12Z,,0.9313,0.6,0.245967011671036,0.14251082689208153
Biztoc.com,https://biztoc.com/x/0f6991ecb99883c7,Meta: No Need To Worry About AI CapEx,2025-11-10T08:37:22Z,META,-0.6249,0.6,0.24294685610365183,0.027338809717343936
Oxaide.com,https://oxaide.com,Show HN: Oxaide – Meta-certified AI help desk (auto-learns from conversations),2025-11-10T07:45:33Z,META,0.8948,0.6,0.23112497462753034,0.13138068057727334
The Times of India,https://economictimes.indiatimes.com/news/international/canada/are-facebook-ads-helping-users-buy-illegal-drugs-by-mail-in-canada-drugs-travel-through-an-ad-to-a-postal-delivery-9-million-worth-of-illegal-drugs-were-turned-over-to-police-in-2024-by-canada-post/articleshow/125218159.cms,Are Facebook ads helping users buy illegal drugs by mail in Canada - Drugs travel through an ad to a postal delivery; $9 million worth of illegal drugs were turned over to police in 2024 by Canada Post,2025-11-10T07:26:25Z,META,-0.8481,0.6,0.2269066793454906,0.01034013737777401
CNET,https://www.cnet.com/deals/this-black-friday-deal-slashes-lgs-65-inch-oled-tv-to-a-new-low-of-997/,This Black Friday Deal Slashes LG's 65-Inch OLED TV to a New Low of $997,2025-11-10T14:27:15Z,,0.3321,0.6,0.24900789322040537,0.09951102436767059
Business Insider,https://www.businessinsider.com/spectral-compute-funding-pitch-deck-nvidia-cuda-2025-11,This startup is creating a tool to break Nvidia's chip lock-in. Read the pitch deck Spectral Compute used to raise $6 million.,2025-11-10T14:23:39Z,,0.0258,0.6,0.24814639003022804,0.07636457006790238
CNET,https://www.cnet.com/deals/black-friday-doorbuster-hisenses-2025-u6-series-75-inch-mini-led-fire-tv-is-750/,Black Friday Doorbuster: Hisense’s 2025 U6 Series 75-Inch Mini-LED Fire TV Is $750,2025-11-10T14:07:00Z,,0.5984,0.6,0.2442005514964065,0.11709904845355684
Phoronix,https://www.phoronix.com/review/opensuse-tw-cachyos,Can openSUSE Tumbleweed Compete With CachyOS Performance?,2025-11-10T14:00:00Z,AMD,0.4404,0.6,0.24256043227559018,0.10481521399492802
Biztoc.com,https://biztoc.com/x/ef01f0ae8eeb0589,Prediction: AMD Stock Will Soar Over the Next 5 Years. Here's 1 Reason Why,2025-11-10T13:48:04Z,AMD,0.0,0.6,0.23978977179701208,0.07193693153910362
Kotaku,https://kotaku.com/asus-tuf-27-gaming-monitor-has-never-been-cheaper-after-third-price-drop-with-3-year-warranty-included-2000642316,"ASUS TUF 27″ Gaming Monitor Has Never Been Cheaper After Third Price Drop, With 3-Year Warranty Included",2025-11-10T13:45:25Z,,0.8777,0.6,0.23917880573614317,0.1347318130592268
Yahoo Entertainment,https://finance.yahoo.com/news/live/earnings-live-instacart-stock-jumps-tyson-rises-with-coreweave-results-ahead-134023513.html,"Earnings live: Instacart stock jumps, Tyson rises with CoreWeave results ahead",2025-11-10T13:40:23Z,,0.7269,0.6,0.23802264050411634,0.12331238936596756
Business Insider,https://www.businessinsider.com/big-short-michael-burry-palantir-stock-alex-karp-puts-ai-2025-11,'Big Short' investor Michael Burry fires back after Alex Karp blasted his bet against Palantir,2025-11-10T13:39:43Z,,0.3036,0.6,0.23786992485738517,0.09302617021322618
PC Gamer,https://www.pcgamer.com/hardware/at-a-company-sports-day-nvidia-ceo-jensen-huang-acknowledges-without-tsmc-there-is-no-nvidia-today-and-says-thank-you-to-the-pride-of-the-world-company/,"At a company sports day, Nvidia CEO Jensen Huang acknowledges 'without TSMC, there is no Nvidia today' and says thank you to the 'pride of the world' company",2025-11-10T13:34:41Z,AMD,0.872,0.6,0.2367200857900819,0.13294200017971
imaging resource,https://www.imaging-resource.com/news/razer-blade-14-limited-time-black-friday-deal/,Powerful Razer Blade 14 Sees Price Plummet by $250 in This Limited-Time Deal,2025-11-10T13:23:35Z,,0.8856,0.6,0.23420395650313328,0.13248449411469246
Notebookcheck.net,https://www.notebookcheck.net/Xiaomi-2K-Gaming-Monitor-G27Qi-2026-Xiaomi-confirms-global-release-for-new-gaming-monitor-with-three-upgrades-on-older-model.1159512.0.html,Xiaomi 2K Gaming Monitor G27Qi 2026: Xiaomi confirms global release for new gaming monitor with three upgrades on older model,2025-11-10T13:22:00Z,,0.2023,0.6,0.23384723463944085,0.0843463590620999
Wccftech,https://wccftech.com/newly-submitted-linux-patches-to-make-amdgpu-the-default-driver-for-gcn-1-1-gpus/,Newly Submitted Linux Patches To Make AMDGPU The Default Driver For GCN 1.1 GPUs,2025-11-10T13:00:39Z,,0.5908,0.6,0.22908985685044178,0.10933084328330483
Businessesgrow.com,https://businessesgrow.com/2025/11/10/text-matters/,Why text matters so much to AI search success (and more!),2025-11-10T13:00:20Z,,0.9298,0.6,0.22902002593564555,0.13258885381518265
Internet,https://thehackernews.com/2025/11/weekly-recap-hyper-v-malware-malicious.html,"⚡ Weekly Recap: Hyper-V Malware, Malicious AI Bots, RDP Exploits, WhatsApp Lockdown and More",2025-11-10T12:51:00Z,,-0.9009,0.6,0.226971441158122,0.006747860945630965
9to5Toys,http://9to5toys.com/2025/11/10/acer-nitro-v-16-with-rtx-5050-gpu-delivers-serious-value-today/,Acer’s Nitro V 16 with RTX 5050 GPU is a great starter gaming laptop and it delivers serious value today at $629 low,2025-11-10T12:36:45Z,AMD,0.8481,0.6,0.2238789837490094,0.12412522495996328
Yahoo Entertainment,https://finance.yahoo.com/news/amd-set-reveal-major-surprises-122924896.html,AMD Set to Reveal Major Surprises on Nov. 11 -- Investors Don't Miss This,2025-11-10T12:29:24Z,AMD,0.4092,0.6,0.22230043402094604,0.09397973148669514
Biztoc.com,https://biztoc.com/x/b7242eb469723be6,"Nvidia, AMD Lead Semiconductor Rally After Taiwan Semiconductor's Strong October Sales",2025-11-10T12:18:51Z,"AMD,NVDA",0.9337,0.6,0.22005405763188296,0.12765555937283163
Biztoc.com,https://biztoc.com/x/0866bf5fe4b95ee1,Could Buying Advanced Micro Devices Stock Today Set You Up for Life?,2025-11-10T12:07:24Z,AMD,0.9186,0.6,0.2176417275081361,0.12527022551913297
9to5Toys,http://9to5toys.com/2025/11/10/samsung-37-inch-odyssey-g7-curved-gaming-monitor-all-time-low/,Samsung’s 2025 37-inch Odyssey G7 165Hz 4K UHD curved gaming monitor hits new all-time low at $300 off,2025-11-10T11:48:24Z,,0.5106,0.6,0.21369694574367903,0.09684318187212047
PCWorld,https://www.pcworld.com/article/2960256/asus-vivobook-16-flip-review.html,Asus Vivobook 16 Flip review: An affordable yet bland OLED 2-in-1,2025-11-10T11:30:00Z,,0.0,0.6,0.20994489796239305,0.0629834693887179
Elearningindustry.com,https://elearningindustry.com/metrics-that-really-matter-how-top-learning-teams-measure-success,Metrics That Really Matter: How Top Learning Teams Measure Success,2025-11-10T14:00:04Z,,0.9355,0.6,0.2425759688137035,0.14085173629167694
Plos.org,https://journals.plos.org/plosone/article?id=10.1371/journal.pone.0336146,crm12comb: Phase I/II adaptive design for drug combinations based on CRM design through R,2025-11-10T14:00:00Z,CRM,-0.5574,0.6,0.2425603996264433,0.03220716986239914
Hubspot.com,https://blog.hubspot.com/sales/bias-in-ai-prospecting-models#article,Detecting bias in AI prospecting models: A how-to for sales leaders,2025-11-10T14:00:00Z,,-0.8641,0.6,0.24256039795292655,0.009889187424540818
Focuspocusmedia.com,https://www.focuspocusmedia.com/lead-generation-marketing-strategies-for-b2b-growth/,Lead Generation Marketing for B2B & SaaS Companies,2025-11-10T13:31:13Z,,0.6369,0.6,0.23593135581450542,0.11585881089982918
Ehotelier.com,https://insights.ehotelier.com/insights/2025/11/10/agentic-search-and-ai-the-future-of-hotel-marketing/,Agentic Search and AI: The future of hotel marketing,2025-11-10T12:37:36Z,,0.0,0.6,0.22406224520231974,0.06721867356069591
Oreilly.com,https://www.oreilly.com/radar/fixing-enterprise-apps-with-ai-the-tn-problem/#BlogPosting,Fixing Enterprise Apps with AI: The T+n Problem,2025-11-10T12:01:14Z,,-0.9255,0.6,0.21635347652870288,0.004835500200416509
Hubspot.com,https://blog.hubspot.com/marketing/generative-ai-tools#article,Generative AI tools every marketing team should use,2025-11-10T12:00:04Z,,-0.9353,0.6,0.21611061303443124,0.004194706998998309
Pypi.org,https://pypi.org/project/odoo-addon-survey-crm-generation/17.0.1.0.2/,odoo-addon-survey-crm-generation 17.0.1.0.2,2025-11-10T11:59:17Z,CRM,0.3182,0.6,0.2159477010266575,0.08539867784800197
TechRadar,https://www.techradar.com/pro/agentic-ai-four-ways-its-delivering-on-business-expectations,Agentic AI: four ways it's delivering on business expectations,2025-11-10T11:45:18Z,,-0.34,0.6,0.21306013159972476,0.0421859060567455
GlobeNewswire,https://www.globenewswire.com/news-release/2025/11/10/3184334/28124/en/Supply-Chain-Management-Software-Industry-Research-2025-Market-to-Reach-22-9-Billion-by-2030-with-Blue-Yonder-Coupa-Descartes-Systems-Group-E2open-Epicor-at-the-Forefront.html,"Supply Chain Management Software Industry Research 2025: Market to Reach $22.9 Billion by 2030 with Blue Yonder, Coupa, Descartes Systems Group, E2open, Epicor at the Forefront",2025-11-10T11:45:00Z,,0.7003,0.6,0.21299860509938637,0.10864845847514598
ZDNet,https://www.zdnet.com/article/salesforce-vs-hubspot/,Salesforce vs HubSpot: Which is the better business CRM?,2025-11-10T11:00:44Z,CRM,0.9281,0.6,0.2041122109619873,0.11806462618674232
Finextra,https://www.finextra.com/pressarticle/107857/smartsearch-appoints-chief-revenue-officer-seyfi-gnay,SmartSearch appoints chief revenue officer Seyfi Günay,2025-11-10T09:47:00Z,,0.9651,0.6,0.19012590035549876,0.11208492203657718
Biztoc.com,https://biztoc.com/x/5d49d5c96e14b13e,Think It's Too Late to Buy Alphabet (Google) Stock? Here's the 1 Reason Why There's Still Time,2025-11-10T12:19:10Z,,0.8225,0.6,0.22012112812905085,0.12035122680455855
Biztoc.com,https://biztoc.com/x/3a1a8e1a096a8667,Could Buying Alphabet Today Set You Up for Life?,2025-11-10T09:42:57Z,GOOGL,0.9186,0.6,0.18938604492951733,0.10900681974053159
GlobeNewswire,https://www.globenewswire.com/news-release/2025/11/10/3184695/28124/en/Virtual-Reality-Market-Competitive-Analysis-Report-2025-Key-Players-Recent-Developments-Strategy-Sustainability-Product-Launch-Key-Persons-and-Revenue-Forecast-to-2033.html,"Virtual Reality Market Competitive Analysis Report 2025: Key Players, Recent Developments, Strategy, Sustainability, Product Launch, Key Persons and Revenue Forecast to 2033",2025-11-10T14:29:00Z,,0.872,0.6,0.24942768331017565,0.14007858694699463
Science Daily,https://www.sciencedaily.com/releases/2025/11/251110021050.htm,New research finds no clear link between acetaminophen (Tylenol) and autism,2025-11-10T14:24:43Z,,-0.9003,0.6,0.24840126327148032,0.007429681784449977
Fortune,https://fortune.com/2025/11/10/nvidia-hometown-santa-clara-california-data-centers-empty-power-grid/,Data centers in Nvidia’s hometown stand empty awaiting power,2025-11-10T14:23:37Z,,-0.4606,0.6,0.24813835081621832,0.04015374792908045
Yahoo Entertainment,https://finance.yahoo.com/news/conviction-long-term-growth-broadcom-142302037.html,Do You Have Conviction in the Long-Term Growth of Broadcom Inc. (AVGO)?,2025-11-10T14:23:02Z,,0.3818,0.6,0.24799904034617834,0.10280552218510476
Biztoc.com,https://biztoc.com/x/3774ec033bacb7b8,"Majestic Labs, which makes patent-pending server architecture that promises more memory capacity, raised $100M, including a $71M Series A led by Bow Wave",2025-11-10T14:21:17Z,,0.5994,0.6,0.24758157940716635,0.11879459343114657
CNA,https://www.channelnewsasia.com/business/verizon-seeks-10-billion-bond-sale-fund-frontier-deal-bloomberg-news-reports-5458246,"Verizon seeks $10 billion from bond sale to fund Frontier deal, Bloomberg News reports",2025-11-10T14:14:34Z,,0.0258,0.6,0.24598584011347652,0.07569968243652127
Fb.com,https://about.fb.com/news/2025/11/how-meta-is-helping-brands-connect-with-customers-through-culture-to-drive-brand-impact/,How Meta is helping brands connect with customers through culture to drive brand impact,2025-11-10T14:00:53Z,META,0.8555,0.6,0.24276671547320927,0.13513609216816194
CNBC,https://www.cnbc.com/2025/11/10/majestic-labs-meta-google-ai-funding.html,"Former Google, Meta executives raise $100 million for high-capacity AI servers startup",2025-11-10T14:00:01Z,META,0.0,0.6,0.24256424862490858,0.07276927458747257
Plos.org,https://journals.plos.org/plosone/article?id=10.1371/journal.pone.0336109,Elucidation and application of the neuroimmune axis between depression and autoimmune diseases: A genome wide and cohort study,2025-11-10T14:00:00Z,,-0.8979,0.6,0.24256035528214479,0.007429623682292092
Plos.org,https://journals.plos.org/plosone/article?id=10.1371/journal.pone.0336233,Predicting in-hospital mortality in children in low- and middle-income countries: A systematic review and meta-analysis of vital signs and anthropometric measurements,2025-11-10T14:00:00Z,META,-0.4767,0.6,0.242560354235224,0.03807955001138782
Plos.org,https://journals.plos.org/plosone/article?id=10.1371/journal.pone.0336612,A national study of substance use: Demonstrated use of recommendations for best practice online data collection,2025-11-10T14:00:00Z,,0.2023,0.6,0.24256035318830332,0.08748909379148911
Plos.org,https://journals.plos.org/plosone/article?id=10.1371/journal.pone.0336394,Multi-modal inflammatory risk modeling in post-PCI patients using behavioral and physiologic data,2025-11-10T14:00:00Z,,-0.7708,0.6,0.242560352429383,0.01667844983304437
Plos.org,https://journals.plos.org/plosntds/article?id=10.1371/journal.pntd.0013715,TiO2 eliminates Hymenolepis nana eggs via photocatalytic activity,2025-11-10T14:00:00Z,,0.0,0.6,0.2425603519506795,0.07276810558520384
ComicBook.com,http://comicbook.com/tv-shows/review/primes-new-batman-show-is-the-perfect-dark-knight-for-the-cartoon-network-generation-review/,Prime’s New Batman Show Is The Perfect Dark Knight For The Cartoon Network Generation [Review],2025-11-10T14:00:00Z,,0.8251,0.6,0.24256035082981264,0.1328090688898473
Plos.org,https://journals.plos.org/plosntds/article?id=10.1371/journal.pntd.0013699,"People with heart failure, sarcopenia and chagas disease: A systematic review and meta-analysis",2025-11-10T14:00:00Z,META,0.5719,0.6,0.24256034823780814,0.11438418341850318
Plos.org,https://journals.plos.org/plosntds/article?id=10.1371/journal.pntd.0013293,"Anthropometric and neurocognitive consequences of Campylobacter, enterotoxigenic Escherichia coli, and norovirus: A systematic review",2025-11-10T14:00:00Z,,0.765,0.6,0.24256034726872538,0.12843570387879008
Plos.org,https://journals.plos.org/plosone/article?id=10.1371/journal.pone.0336291,Population homogeneity with unequal exploitation and recruitment contribution within the 2700 km geographic distribution of the commercial hairy crab Romaleon setosum (Decapoda: Cancridae) in Chile,2025-11-10T14:00:00Z,,0.6486,0.6,0.24256034561856038,0.11996549573602759
Plos.org,https://journals.plos.org/plosone/article?id=10.1371/journal.pone.0336493,"Evaluation of MoveSmart MS - an online structured exercise, Social Cognitive Theory-based behavioural coaching and peer support programme - on anxiety in multiple sclerosis",2025-11-10T14:00:00Z,,0.8074,0.6,0.24256034190179723,0.13152106858599247
Plos.org,https://journals.plos.org/plosone/article?id=10.1371/journal.pone.0336566,"Establishing a dementia care competency framework for care partners, health and social care providers: A modified Delphi study protocol",2025-11-10T14:00:00Z,,0.9831,0.6,0.24256033995584797,0.14430642304993263
Plos.org,https://journals.plos.org/plosone/article?id=10.1371/journal.pone.0335168,Identifying key determinants of health among China’s migrant population using machine learning methods: Evidence from the china migrants dynamic survey,2025-11-10T14:00:00Z,,0.8519,0.6,0.24256033881941366,0.13475924743790166
CoinDesk,https://www.coindesk.com/markets/2025/11/10/microsoft-deal-supercharges-iren-s-ai-ambitions-canaccord-says,"Microsoft Deal Supercharges IREN’s AI Ambitions, Canaccord Says",2025-11-10T09:09:14Z,MSFT,0.0,0.6,0.1833373948650604,0.055001218459518116
