source,url,title,published_at,tickers,sentiment,trust,recency,score
Phoronix,https://www.phoronix.com/review/google-cloud-n4d-amd-epyc-turin,Google Cloud N4D Delivers Great VM Performance & Value Powered By AMD EPYC Turin,2025-11-10T17:00:00Z,AMD,0.9392,0.6,0.2403407050836781,0.13982060858948056
9to5google.com,http://9to5google.com/2025/11/10/deals-razr-ultra-bose-ultra-buds-anker-black-friday-sale/,"Deals: Razr Ultra 1TB $400 off, new Bose Ultra buds, Starlink Mini $269 off, Anker early Black Friday sale, more",2025-11-10T16:58:46Z,,0.9413,0.6,0.24005550641250425,0.13980592637957834
Liliputing,https://liliputing.com/minisforum-ms-r1-arm-powered-desktop-pc-goes-global-for-504-and-up/,MINISFORUM MS-R1 Arm-powered Desktop PC goes global for $504 and up,2025-11-10T16:54:04Z,,0.0,0.6,0.2389717774434864,0.07169153323304592
PCWorld,https://www.pcworld.com/article/2967604/amds-newest-ryzen-x3d-cpu-is-exclusive-to-micro-centers-pre-built-pc.html,AMD’s newest Ryzen X3D CPU is exclusive to Micro Center’s pre-built PC,2025-11-10T16:49:27Z,AMD,0.8968,0.6,0.23791202546660514,0.135381458971517
PC Gamer,https://www.pcgamer.com/hardware/processors/a-few-redditors-faked-the-recent-ryzen-7-9700x3d-benchmark-leaks-and-explain-why-you-cant-trust-online-bench-databases/,A few Redditors faked the recent Ryzen 7 9700X3D benchmark leaks and explain 'why you can't trust online bench databases',2025-11-10T16:48:03Z,AMD,0.8657,0.6,0.23759158563832816,0.13298238639762863
GlobeNewswire,https://www.globenewswire.com/news-release/2025/11/10/3184873/28124/en/United-States-Cloud-Computing-Market-Analysis-Report-2025-2033-Featuring-Amazon-Google-Microsoft-Alibaba-Salesforce-Adobe-Oracle-and-IBM.html,"United States Cloud Computing Market Analysis Report 2025-2033 Featuring Amazon, Google, Microsoft, Alibaba, Salesforce, Adobe, Oracle, and IBM",2025-11-10T16:50:00Z,,0.743,0.6,0.2380380150561445,0.12447007807285794
Wired,https://www.wired.com/story/heres-where-to-build-data-centers-to-keep-emissions-down/,"If the US Has to Build Data Centers, Here’s Where They Should Go",2025-11-10T17:40:27Z,META,0.5423,0.6,0.24988446051985605,0.11561904103793219
Facebook.com,https://developers.facebook.com/blog/post/2025/11/10/platform-evolution-facebook-social-plugins-to-be-discontinued-february-2026/,Platform Evolution: Facebook Social Plugins to Be Discontinued February 2026,2025-11-10T17:30:39Z,META,0.7837,0.6,0.2475380099278249,0.13246006449247838
Financial Post,https://financialpost.com/pmn/business-pmn/ais-5-trillion-data-center-boom-will-dip-into-every-debt-market-jpmorgan-says,"AI’s $5 Trillion Data-Center Boom Will Dip Into Every Debt Market, JPMorgan Says",2025-11-10T17:29:47Z,,-0.872,0.6,0.24733156316886043,0.009497532025684239
Business Insider,https://www.businessinsider.com/stock-market-bubble-warning-dot-com-crash-ai-stocks-goldman-2025-11,Goldman Sachs says watch these 5 warnings from the dot-com bubble to know if the AI craze is peaking,2025-11-10T17:26:43Z,,-0.7506,0.6,0.2466024435936591,0.01845079482967757
Theflightdeal.com,https://www.theflightdeal.com/2025/11/10/alaska-air-seattle-kauai-hawaii-and-vice-versa-217-basic-economy-327-regular-economy-roundtrip-including-all-taxes/,"Alaska Air: Seattle – Kauai, Hawaii (and vice versa). $217 (Basic Economy) / $327 (Regular Economy). Roundtrip, including all Taxes",2025-11-10T17:25:20Z,,0.7003,0.6,0.2462742505320781,0.1256220324539077
Financial Post,https://financialpost.com/pmn/business-pmn/duke-explores-private-credit-in-potential-first-for-utilities,Duke Explores Private Credit in Potential First for Utilities,2025-11-10T17:24:38Z,,0.875,0.6,0.24610834289314867,0.13843594287739613
The Times of India,https://economictimes.indiatimes.com/news/international/us/data-center-debt-skyrockets-112-25-billion-issued-as-ai-boom-fuels-borrowing-frenzy/articleshow/125228221.cms,Data center debt skyrockets 112% — $25 billion issued as AI boom fuels borrowing frenzy,2025-11-10T17:24:00Z,,-0.8689,0.6,0.24595833149833204,0.009673541177829398
Biztoc.com,https://biztoc.com/x/33a28fa442ab6ef4,Meet the millennial Meta cofounder and his wife who are giving away $20 billion,2025-11-10T17:19:48Z,META,0.7845,0.6,0.24496584060529905,0.13114246276804684
Search Engine Journal,https://www.searchenginejournal.com/meta-projected-16b-from-scam-ads-internal-docs-show/560463/,"Meta Projected $16B From Scam Ads, Internal Docs Show via @sejournal, @MattGSouthern",2025-11-10T17:16:17Z,META,-0.9559,0.6,0.24413790700315294,0.003229944509651715
Ambcrypto.com,https://ambcrypto.com/top-12-nft-games-of-november-2025/,Top 12 NFT Games of November 2025,2025-11-10T17:15:21Z,,0.6124,0.6,0.2439186411044294,0.11798832507503458
Yahoo Entertainment,https://finance.yahoo.com/news/meet-millennial-meta-cofounder-wife-170849820.html,Meet the millennial Meta cofounder and his wife who are giving away $20 billion,2025-11-10T17:08:49Z,META,0.1027,0.6,0.2423892875767996,0.08018480022328107
Fortune,https://fortune.com/2025/11/10/meet-the-millennial-meta-cofounder-and-his-wife-who-are-giving-away-20-billion/,Meet the millennial Meta cofounder and his wife who are giving away $20 billion,2025-11-10T17:08:49Z,META,0.1027,0.6,0.24238928697398074,0.08018480002386257
Overreacted.io,https://overreacted.io/hire-me-in-japan/,Hire Me in Japan — overreacted,2025-11-10T17:05:32Z,,0.743,0.6,0.24162433194235722,0.12634536317265857
Study Finds,https://studyfinds.org/empathy-chatgpt-more-human-than-doctors/,"STUDY: When It Comes To Empathy, CHATGPT More 'Human' Than Real Doctors!",2025-11-10T17:00:16Z,,0.7177,0.6,0.24040233764976746,0.12388172861430165
Fb.com,https://engineering.fb.com/2025/11/10/ml-applications/metas-generative-ads-model-gem-the-central-brain-accelerating-ads-recommendation-ai-innovation/,Meta’s Generative Ads Model (GEM): The Central Brain Accelerating Ads Recommendation AI Innovation,2025-11-10T17:00:01Z,META,0.9325,0.6,0.24034448419488524,0.13933971471198472
Activistpost.com,https://www.activistpost.com/cold-harbor-eugenics-epstein-and-big-tech/,"Cold Harbor: Eugenics, Epstein and Big Tech",2025-11-10T17:00:00Z,,0.7184,0.6,0.24034062712890353,0.12390040009749234
Yahoo Entertainment,https://finance.yahoo.com/news/ai-5-trillion-data-center-165808446.html,"AI’s $5 trillion data center boom will dip into every debt market, JPMorgan says",2025-11-10T16:58:08Z,,-0.872,0.6,0.23990911046552393,0.009212509841876118
Theflightdeal.com,https://www.theflightdeal.com/2025/11/10/scandinavian-airlines-los-angeles-prague-czechia-473-basic-economy-573-regular-economy-roundtrip-including-all-taxes/,"Scandinavian Airlines: Los Angeles – Prague, Czechia. $473 (Basic Economy) / $573 (Regular Economy). Roundtrip, including all Taxes",2025-11-10T16:55:16Z,,0.7003,0.6,0.23924793264956268,0.12203797796521541
Gizmodo.com,https://gizmodo.com/smart-glasses-are-already-getting-ridiculously-light-2000683643,Smart Glasses Are Already Getting Ridiculously Light,2025-11-10T16:45:09Z,META,0.7096,0.6,0.23692912053090726,0.12151620733789172
Theflightdeal.com,https://www.theflightdeal.com/2025/11/10/american-dallas-lisbon-portugal-497-basic-economy-697-regular-economy-roundtrip-including-all-taxes/,"American: Dallas – Lisbon, Portugal. $497 (Basic Economy) / $697 (Regular Economy). Roundtrip, including all Taxes",2025-11-10T16:45:07Z,,0.7003,0.6,0.23692151682885826,0.12085129651923229
Blockspace.media,https://blockspace.media/insight/michael-saylors-strategy-holds-mstr-sales-buys-497-bitcoin-with-preferred-equity/,"Michael Saylor’s Strategy holds MSTR sales, buys 497 Bitcoin with preferred equity",2025-11-10T17:30:43Z,MSTR,0.0,0.6,0.2475538590945669,0.07426615772837007
BeInCrypto,https://beincrypto.com/microstrategy-50-million-bitcoin-purchase/,MicroStrategy Buys $50 Million In Bitcoin Despite Market Turbulence,2025-11-10T17:22:55Z,,0.5106,0.6,0.24570191526889398,0.11134719396155739
Biztoc.com,https://biztoc.com/x/654f4a61a98e75ca,Strategy Buys 487 BTC But MSTR Teeters Below $240,2025-11-10T17:08:37Z,MSTR,0.5267,0.6,0.24234259263887473,0.110995330854531
Decrypt,https://decrypt.co/348000/strategy-buys-bitcoin-preferred-shares-key-premium-evaporates,Strategy Buys Bitcoin With Proceeds From Preferred Shares as Key Premium Evaporates,2025-11-10T16:45:48Z,,0.6249,0.6,0.23707740451122075,0.11556812237708478
The Daily Caller,https://dailycaller.com/2025/11/10/exclusive-us-nuclear-bomber-fleet-shares-fence-trailer-park-linked-chinese-intel-miles-guo/,EXCLUSIVE: US Nuclear Bomber Fleet Shares Fence With Trailer Park Linked To Chinese Intel-Tied Fraudster,2025-11-10T17:35:47Z,,0.6408,0.6,0.24876425753207257,0.1224517181275874
Screen Rant,https://screenrant.com/stranger-things-season-3-worst/,The Hard Truth About Stranger Things Needs To Be Said,2025-11-10T16:46:22Z,,0.3612,0.6,0.23720673137840328,0.09686574082568476
HackRead,https://hackread.com/landfall-spyware-samsung-galaxy-malicious-images/,LANDFALL Spyware Targeted Samsung Galaxy Phones via Malicious Images,2025-11-10T16:41:13Z,SPY,-0.3818,0.6,0.23603358749661693,0.04377478913712258
Biztoc.com,https://biztoc.com/x/9f4cfd5ab218d660,Bank of America revamps AMD stock forecast before key event,2025-11-10T18:38:00Z,AMD,0.7096,0.6,0.2492813824912784,0.12785143545212688
9to5Toys,http://9to5toys.com/2025/11/10/treat-yourself-this-singles-day-with-these-gaming-laptop-deals/,Treat yourself this Singles’ Day with these gaming laptop deals: RTX 50-series GPU-powered models up to $900 off,2025-11-10T18:22:05Z,,0.9694,0.6,0.2454907464349221,0.14504084280868068
Slickdeals.net,https://slickdeals.net/f/18789736-ibuypower-y40-pro-gaming-desktop-pc-amd-ryzen-9-7900x-nvidia-geforce-rtx-5080-16gb-32gb-ddr5-rgb-2tb-nvme-ssd-black,"iBUYPOWER - Y40 PRO Gaming Desktop PC -AMD Ryzen 9 7900X, NVIDIA GeForce RTX 5080 16GB, 32GB DDR5 RGB,2TB NVMe SSD - Black (2 replies)",2025-11-10T18:04:14Z,AMD,0.8591,0.6,0.24130820473338957,0.13458482502595334
Omgubuntu.co.uk,https://www.omgubuntu.co.uk/2025/11/minisforum-ms-r1-linux-arm-workstation,Minisforum MS-R1 is a 12-Core Linux ARM Workstation for AI and VMs,2025-11-10T17:50:14Z,,0.765,0.6,0.23807770367939332,0.12606214409823877
Theregister.com,https://www.theregister.com/2025/11/10/5k_facebook_advertising_customers_phishing/,Phishers try to lure 5K Facebook advertisers with fake business pages,2025-11-10T18:34:46Z,,-0.6249,0.6,0.24850656997268306,0.027964444319026022
Theflightdeal.com,https://www.theflightdeal.com/2025/11/10/singapore-air-san-francisco-bali-indonesia-678-roundtrip-including-all-taxes/,"Singapore Air: San Francisco – Bali, Indonesia. $678. Roundtrip, including all Taxes",2025-11-10T18:25:42Z,,0.7003,0.6,0.24634691356572166,0.12565909714073895
Forbes,https://www.forbes.com/sites/tylerroush/2025/11/10/the-worlds-10-richest-people-became-40-billion-richer-as-shutdown-deal-advances/,The World’s 10 Richest People Became $40 Billion Richer As Shutdown Deal Advances,2025-11-10T18:12:27Z,,0.8176,0.6,0.2432245093042838,0.13262546043343987
Meta.com,https://ai.meta.com/blog/omnilingual-asr-advancing-automatic-speech-recognition/,Meta Omnilingual ASR: Advancing Automatic Speech Recognition for 1600 Languages,2025-11-10T18:10:12Z,META,0.6369,0.6,0.24269823384836042,0.11918182169591436
Crypto Briefing,https://cryptobriefing.com/senators-meta-openai-alphabet-oracle-wsj-letter/,"Lawmakers target Meta, OpenAI, Alphabet, Oracle over AI-driven power costs",2025-11-10T18:04:41Z,META,0.128,0.6,0.24141269878011876,0.0816940572671922
The Irish Times,https://www.irishtimes.com/business/2025/11/10/european-shares-soar-on-hopes-of-end-to-us-government-shutdown/,European shares soar on hopes of end to US government shutdown,2025-11-10T18:04:17Z,,0.9337,0.6,0.24131975222376895,0.1399920014625306
Theflightdeal.com,https://www.theflightdeal.com/2025/11/10/qatar-airways-american-philadelphia-bangkok-thailand-847-roundtrip-including-all-taxes-2/,"Qatar Airways / American: Philadelphia – Bangkok, Thailand. $847. Roundtrip, including all Taxes",2025-11-10T17:55:58Z,,0.8115,0.6,0.2393953408715434,0.13009939799664025
Biztoc.com,https://biztoc.com/x/5428c09d103c38c8,"Michael Saylor’s Strategy holds MSTR sales, buys 497 Bitcoin with preferred equity",2025-11-10T18:04:45Z,MSTR,0.0,0.6,0.24142815800707706,0.07242844740212312
Biztoc.com,https://biztoc.com/x/c5d484267c0e62da,"Nvidia Rival Weathering AI Storm, Looks To Reclaim Buy Point",2025-11-10T17:54:07Z,NVDA,0.886,0.6,0.2389693096036745,0.13520883537375902
The-sun.com,https://www.the-sun.com/news/15466313/pics-putin-fists-bulging-veins-ill-health-rumours/,Putin clenching fists 'in agony' as bulging veins spark health rumors...,2025-11-10T18:34:39Z,,-0.3802,0.6,0.24847857648916497,0.046202106512395334
ComicBook.com,http://comicbook.com/anime/news/shonen-jump-cancels-its-weirdest-series-in-just-a-year/,Shonen Jump Cancels Its Weirdest Series in Just a Year,2025-11-10T18:30:00Z,SPY,0.2415,0.6,0.24736872846493835,0.09213248291676629
Longwarjournal.org,https://www.longwarjournal.org/archives/2025/11/houthis-arrest-alleged-members-of-saudi-american-israeli-spy-ring.php,Houthis arrest alleged members of Saudi-American-Israeli spy ring,2025-11-10T18:23:03Z,SPY,-0.8834,0.6,0.2457191584687407,0.008595256163236552
Variety,https://variety.com/2025/film/news/afm-buzz-titles-2025-1236572987/,"AFM Buzz Titles: Seth Rogen, Jason Statham, Hunter Schafer, Shailene Woodley and More Stars Pepper Pics for Sale at Market",2025-11-10T18:15:00Z,,0.9325,0.6,0.2438222502683892,0.14135594959309863
Reason,https://reason.com/2025/11/10/genes-matter-says-scientist-studying-social-media-and-mental-health/,"'Genes Matter,' Says Scientist Studying Social Media and Mental Health",2025-11-10T17:56:18Z,,0.0258,0.6,0.2394720965984636,0.0736951430072112
GeekTyrant,https://geektyrant.com/news/roger-rabbit-creator-developing-live-action-jessica-rabbit-movie-after-winning-back-rights-from-disney,ROGER RABBIT Creator Developing Live-Action Jessica Rabbit Movie After Winning Back Rights from Disney,2025-11-10T17:55:00Z,,-0.6597,0.6,0.23917257993070046,0.024417128685125213
Biztoc.com,https://biztoc.com/x/ddc3de6fd703337e,Veteran analyst delivers bold twist on Tesla stock,2025-11-10T18:26:57Z,TSLA,0.9423,0.6,0.24664344035321728,0.14371666625941615
Yahoo Entertainment,https://finance.yahoo.com/video/tesla-shake-warren-buffett-quiet-181027685.html,"Tesla shake-up, Warren Buffett to 'go quiet' from Berkshire",2025-11-10T18:10:27Z,TSLA,0.0,0.6,0.2427565545558165,0.07282696636674495
Observer,https://observer.com/2025/11/openai-revenue-model/,Sam Altman Projects OpenAI Revenue to Hit $20B—Where the Money Comes From,2025-11-10T19:43:41Z,,0.7964,0.6,0.24266313786002502,0.13077601825552468
IGN,https://www.ign.com/articles/ibuypower-y40-pro-rtx-5080-gaming-pc-deal-early-black-friday-sale,"The Liquid Cooled iBuypower Y40 Pro GeForce RTX 5080 Gaming PC Drops to $1,950 for Black Friday",2025-11-10T19:40:00Z,AMD,0.8555,0.6,0.2418041871079715,0.13460030075365234
TechRadar,https://www.techradar.com/televisions/i-review-tvs-for-a-living-and-these-are-9-of-the-best-black-friday-oled-tv-deals-youll-see-this-year,"I review TVs for a living, and these are 9 of the best Black Friday OLED TV deals you'll see this year",2025-11-10T19:22:57Z,,0.9477,0.6,0.23786758209287692,0.1389884068926889
Dealnews.com,https://www.dealnews.com/products/HP/HP-Pro-Book-465-G11-Ryzen-7-16-Laptop/495686.html,"HP ProBook 465 G11 Ryzen 7 16"" Laptop for $569 + free shipping",2025-11-10T19:20:02Z,AMD,0.7964,0.6,0.2372006127498836,0.12783215422316727
Wccftech,https://wccftech.com/amd-advances-ai-strategy-acquires-mk1-high-speed-inference-reasoning-instinct-gpus/,"AMD Advances Its AI Strategy With The Acquisition of MK1, Brings High-Speed Inference & Reasoning Technologies Optimized For Instinct GPUs",2025-11-10T19:10:18Z,AMD,0.9382,0.6,0.2349883464921578,0.13663632395133007
Notebookcheck.net,https://www.notebookcheck.net/Asus-ROG-Xbox-Ally-with-Bazzite-hits-38-8-FPS-in-Cyberpunk-2077-outperforming-the-Windows-11-version-it-ships-with.1159813.0.html,"ROG Xbox Ally with Bazzite hits 38.8 FPS in Cyberpunk 2077, outperforming the Windows 11 version it ships with",2025-11-10T18:47:00Z,AMD,-0.7555,0.6,0.22977599680193278,0.016854069365421772
BleepingComputer,https://www.bleepingcomputer.com/news/security/cisa-orders-feds-to-patch-samsung-zero-day-used-in-spyware-attacks/,CISA orders feds to patch Samsung zero-day used in spyware attacks,2025-11-10T20:00:34Z,,-0.9643,0.6,0.24663948596851915,0.0026415088947228365
The Daily Caller,https://dailycaller.com/2025/11/10/data-centers-empty-american-power-supply-shot-hell/,California Data Centers Lie Dormant As American Power Supply Is Shot To Hell,2025-11-10T19:51:06Z,,-0.3612,0.6,0.24440192304003713,0.04683718453139272
Business Insider,https://www.businessinsider.com/latham-watkins-ai-academy-associate-training-2025-11,What one Big Law firm told 400 young lawyers about using AI,2025-11-10T19:44:14Z,,0.0772,0.6,0.24279161500523974,0.07846053830509327
ComingSoon.net,https://www.comingsoon.net/tv/news/2059997-hbo-remaking-hit-netflix-tv-show-with-a-twist,HBO Remaking Hit Netflix TV Show With a Twist,2025-11-10T19:42:36Z,,0.9001,0.6,0.24241014446669387,0.13818105465034952
Skepticalscience.com,https://skepticalscience.com/5-ways-rogan-misleads.html,Five ways Joe Rogan misleads listeners about climate change,2025-11-10T19:42:08Z,,0.8952,0.6,0.24230126249895453,0.13776280580640557
Theflightdeal.com,https://www.theflightdeal.com/2025/11/10/lufthansa-san-francisco-bilbao-spain-528-basic-economy-728-regular-economy-roundtrip-including-all-taxes-2/,"Lufthansa: San Francisco – Bilbao, Spain. $528 (Basic Economy) / $728 (Regular Economy). Roundtrip, including all Taxes",2025-11-10T19:35:41Z,,0.7003,0.6,0.24080136751907263,0.12283036955780374
Theflightdeal.com,https://www.theflightdeal.com/2025/11/10/american-los-angeles-la-romana-dominican-republic-371-basic-economy-429-regular-economy-roundtrip-including-all-taxes/,"American: Los Angeles – La Romana, Dominican Republic. $371 (Basic Economy) / $429 (Regular Economy). Roundtrip, including all Taxes",2025-11-10T19:30:54Z,,0.7003,0.6,0.23969504128235497,0.12226604360771642
Theflightdeal.com,https://www.theflightdeal.com/2025/11/10/delta-portland-prague-czechia-497-basic-economy-697-regular-economy-roundtrip-including-all-taxes/,"Delta: Portland – Prague, Czechia. $497 (Basic Economy) / $697 (Regular Economy). Roundtrip, including all Taxes",2025-11-10T19:25:58Z,,0.7003,0.6,0.23855934610516716,0.1216867368547847
Somero.live,https://somero.live,Show HN: Static Home Page,2025-11-10T19:24:20Z,META,0.2732,0.6,0.23818452553821456,0.09097696137457643
Biztoc.com,https://biztoc.com/x/9bd58a66fb918b67,"If the US Has to Build Data Centers, Here’s Where They Should Go",2025-11-10T19:22:58Z,META,0.0516,0.6,0.23787135238824902,0.07504365425144481
Macdailynews.com,https://macdailynews.com/2025/11/10/breaking-bad-stars-unite-in-new-apple-tv-pluribus-promo-drew-barrymore-and-carol-burnett-too/,"‘Breaking Bad’ stars unite in new Apple TV ‘Pluribus’ promo – Drew Barrymore and Carol Burnett, too",2025-11-10T19:20:46Z,,-0.3818,0.6,0.23736808499930553,0.04402228504397121
Theflightdeal.com,https://www.theflightdeal.com/2025/11/10/delta-phoenix-lisbon-portugal-490-basic-economy-690-regular-economy-roundtrip-including-all-taxes/,"Delta: Phoenix – Lisbon, Portugal. $490 (Basic Economy) / $690 (Regular Economy). Roundtrip, including all Taxes",2025-11-10T19:20:41Z,,0.7003,0.6,0.23734904219659114,0.12106937293405916
GSMArena.com,https://www.gsmarena.com/samsung_display_has_started_manufacturing_microoled_displays_for_the_galaxy_xr-news-70223.php,Samsung Display has started manufacturing micro-OLED displays for the Galaxy XR,2025-11-10T19:11:03Z,,0.0,0.6,0.2351580298045414,0.07054740894136241
/FILM,https://www.slashfilm.com/2004355/actors-didnt-deserve-emmy-wins/,15 Actors Who Didn't Deserve Their Emmys,2025-11-10T19:10:00Z,,0.8461,0.6,0.2349204421847339,0.13010598849517116
Theflightdeal.com,https://www.theflightdeal.com/2025/11/10/american-new-york-las-vegas-and-vice-versa-169-basic-economy-269-regular-economy-roundtrip-including-all-taxes/,"American: New York – Las Vegas (and vice versa). $169 (Basic Economy) / $269 (Regular Economy). Roundtrip, including all Taxes",2025-11-10T18:55:34Z,,0.7003,0.6,0.23167878775702655,0.11817703284698165
Notebookcheck.net,https://www.notebookcheck.net/Meta-A-scam-machine-Reuters-uncovers-billion-dollar-scam-involving-fraudulent-advertising-at-the-tech-giant.1159775.0.html,Meta: A scam machine? Reuters uncovers billion-dollar scam involving fraudulent advertising at the tech giant,2025-11-10T18:44:00Z,META,-0.9723,0.6,0.22911328862310762,0.0019039314284580206
The Daily Caller,https://dailycaller.com/2025/11/10/fda-hormone-replacement-therapy-removes-black-box-warning/,FDA Moves To Rectify One Of The ‘Biggest Errors In Modern Medicine’,2025-11-10T18:43:43Z,,-0.743,0.6,0.2290508022764356,0.017659816855513186
Barchart.com,https://www.barchart.com/story/news/36019139/stocks-set-to-open-sharply-higher-as-end-to-u-s-government-shutdown-nears,Stocks Set to Open Sharply Higher as End to U.S. Government Shutdown Nears,2025-11-10T11:22:07Z,,0.5423,0.6,0.14972697320625594,0.06927717323280257
Biztoc.com,https://biztoc.com/x/ab68cb6d39653232,"Wall Street is Pounding the Table Over NVDA, RUN, LLY",2025-11-10T18:49:40Z,NVDA,0.296,0.6,0.2303665652843028,0.08956652058253692
Deadline,http://deadline.com/2025/11/malcolm-d-lee-developing-taye-diggs-becoming-marlow-fin-novel-1236612996/,Malcolm D. Lee Developing Two Dramas: A Spy Series Led By Taye Diggs & ‘Becoming Marlow Fin’ Novel Adaptation,2025-11-10T20:00:00Z,SPY,0.9643,0.6,0.2465049099306789,0.14526287837304977
Variety,https://variety.com/2025/tv/news/malcolm-d-lee-need-to-know-nbc-becoming-marlow-fin-peacock-1236574204/,"Malcolm D. Lee to Develop Drama ‘Need to Know’ at NBC, ‘Becoming Marlow Fin’ at Peacock",2025-11-10T20:00:00Z,,0.0,0.6,0.24650490949165288,0.07395147284749586
SlashGear,https://www.slashgear.com/2013108/sr-71-blackbird-jp-7-jet-fuel/,The SR-71 Blackbird Can't Use Just Any Jet Fuel – Here's Why (And What It Uses Instead),2025-11-10T19:45:00Z,SPY,0.0258,0.6,0.24297081711392976,0.07477183925864075
Wnd.com,https://www.wnd.com/2025/11/wreak-havoc-u-s-nuclear-bomber-fleet-shares/,‘Wreak havoc’: U.S. nuclear bomber fleet shares fence with trailer park linked to Chinese intel-tied fraudster,2025-11-10T19:29:17Z,,0.1027,0.6,0.23932221771392403,0.0791701828419432
Screen Rant,https://screenrant.com/star-wars-failed-ahsoka-tano/,Star Wars Has Failed Ahsoka Tano,2025-11-10T19:00:21Z,,-0.8934,0.6,0.23274806063416553,0.007443282979080616
Page Six,https://pagesix.com/video/sydney-sweeney-scooter-braun-on-crazy-igloo-date-at-nyc-ice-rink/,"Sydney Sweeney, Scooter Braun on ‘crazy igloo’ date at NYC ice rink",2025-11-10T18:57:59Z,SPY,0.6486,0.6,0.2322183704845153,0.11485056167423158
Freerepublic.com,https://freerepublic.com/focus/f-bloggers/4351802/posts,EXCLUSIVE: US Nuclear Bomber Fleet Shares Fence With Trailer Park Linked To Chinese Intel-Tied Fraudster,2025-11-10T18:52:34Z,,0.8256,0.6,0.2310105837656477,0.12651987651676994
Motley Fool Australia,https://www.fool.com.au/2025/11/11/how-to-make-your-first-10000-in-the-asx-share-market/,"How to make your first $10,000 in the ASX share market",2025-11-10T20:16:30Z,,0.8979,0.6,0.2360562276973372,0.13440333436403287
Notebookcheck.net,https://www.notebookcheck.net/Nvidia-DGX-Spark-vs-AMD-Strix-Halo-4-000-AI-supercomputer-challenged-by-2-199-mini-PC-with-better-real-time-performance.1159829.0.html,"Nvidia DGX Spark vs AMD Strix Halo: $4,000 AI supercomputer challenged by $2,199 mini PC with better real-time performance",2025-11-10T20:58:00Z,AMD,0.875,0.6,0.24567810509563387,0.13819393411629405
Notebookcheck.net,https://www.notebookcheck.net/Open-Book-Touch-Minimalistic-e-book-reader-with-e-ink-display-is-customizable.1159814.0.html,Open Book Touch: Minimalistic e-book reader with e-ink display is customizable,2025-11-10T20:36:00Z,,0.25,0.6,0.2405294809979882,0.09019855537424558
Biztoc.com,https://biztoc.com/x/9a1c0813dd20231b,"AMD Stock Surges, Fueled By Taiwan Semi Growth, Shutdown Deal",2025-11-10T20:18:25Z,AMD,0.9578,0.6,0.23649217191744992,0.13890131225399502
CMSWire,https://www.cmswire.com/customer-data-platforms/which-is-broken-your-cdp-or-your-customer-data-management/,Which Is Broken: Your CDP or Your Customer Data Management?,2025-11-10T20:56:29Z,,-0.91,0.6,0.24531963396329254,0.006623630117008896
Barchart.com,https://www.barchart.com/story/news/36019700/option-volatility-and-earnings-report-for-november-10-14,Option Volatility and Earnings Report for November 10 - 14,2025-11-10T12:00:02Z,,0.0,0.6,0.14636728943230617,0.043910186829691854
CNA,https://www.channelnewsasia.com/business/coreweave-flags-hit-data-center-delay-shares-fall-5458856,"CoreWeave flags hit from data center delay, shares fall",2025-11-10T21:12:11Z,,-0.5719,0.6,0.24905564390455406,0.031986216346661885
Yahoo Entertainment,https://finance.yahoo.com/news/coreweave-beats-third-quarter-revenue-211211858.html,CoreWeave beats third-quarter revenue estimates on AI computing boom,2025-11-10T21:12:11Z,,-0.128,0.6,0.24905564350893855,0.06515295634193832
Screenanarchy.com,https://screenanarchy.com/2025/11/burden-of-dreams-4k-review-werner-herzog-vs-the-jungle.html,BURDEN OF DREAMS 4K Review: Werner Herzog vs. The Jungle,2025-11-10T21:02:04Z,,-0.1779,0.6,0.24664177418939062,0.06082926076832941
Page Six,https://pagesix.com/2025/11/10/royal-family/royal-insiders-appalled-by-prince-harry-at-kris-jenner-party/,Royal insiders appalled by Prince Harry and Meghan Markle living it up at Kris Jenner’s 70th birthday bash: ‘It’s so tacky’,2025-11-10T20:29:55Z,,-0.6501,0.6,0.23912490418741808,0.025100941192553274
