source,url,title,published_at,tickers,sentiment,trust,recency,score
Yahoo Entertainment,https://finance.yahoo.com/news/closing-bell-movers-amazon-soars-233538498.html,Closing Bell Movers: Amazon soars to all-time highs on earnings,2025-10-31T23:35:38Z,,-0.4588,0.6,0.15347065962288436,0.024917496296371505
Financial Post,https://financialpost.com/globe-newswire/purpose-investments-announces-changes-to-certain-investment-funds,Purpose Investments Announces Changes to Certain Investment Funds,2025-10-31T21:13:20Z,,0.25,0.6,0.13382280184842593,0.050183550693159724
Yahoo Entertainment,https://finance.yahoo.com/news/live/earnings-live-amazon-stock-soars-apple-pares-gains-with-earnings-from-ai-players-to-come-211227493.html,"Earnings live: Amazon stock soars, Apple pares gains with earnings from AI players to come",2025-10-31T21:12:27Z,"AAPL,META,MSFT",0.872,0.6,0.1337090483163476,0.07509100153446081
GlobeNewswire,https://www.globenewswire.com/news-release/2025/10/31/3178669/0/en/Purpose-Investments-Announces-Changes-to-Certain-Investment-Funds.html,Purpose Investments Announces Changes to Certain Investment Funds,2025-10-31T21:10:00Z,,0.0,0.6,0.13339404975373323,0.04001821492611997
Forbes,https://www.forbes.com/sites/greatspeculations/2025/10/31/why-american-housing-markets-have-stalled/,Why American Housing Markets Have Stalled,2025-10-31T20:57:45Z,,0.6124,0.6,0.13183015561715816,0.06376888287513174
Macdailynews.com,https://macdailynews.com/2025/10/31/apple-shares-hit-new-all-time-intraday-high-12/,Apple shares hit new all-time intraday high,2025-10-31T20:37:20Z,AAPL,0.6908,0.6,0.12926430384910978,0.06556802548442243
Barchart.com,https://www.barchart.com/story/news/35835708/this-pair-of-new-2x-etfs-goes-double-or-nothing-on-big-tech-should-you-chase-the-volatility-in-apple-nvidia-and-microsoft-now,"This Pair of New 2X ETFs Goes Double or Nothing on Big Tech. Should You Chase the Volatility in Apple, Nvidia, and Microsoft Now?",2025-10-31T20:17:38Z,,0.714,0.6,0.1268358708672587,0.06521900479994443
MarketWatch,https://www.marketwatch.com/story/jerome-powell-says-the-ai-bubble-and-the-dot-com-bust-are-different-hes-wrong-e260ceee,Jerome Powell says the AI bubble and the dot-com bust are different. He’s wrong.,2025-10-31T18:08:00Z,,-0.7068,0.6,0.1119548101327127,0.00984754509927341
Biztoc.com,https://biztoc.com/x/8066efac45a2724d,"As Apple Turns the Corner With the iPhone 17, Should You Buy AAPL Stock for 2026?",2025-10-31T16:19:32Z,"AAPL,NVDA",0.8294,0.6,0.10085400400369758,0.0553506944773093
Yahoo Entertainment,https://consent.yahoo.com/v2/collectConsent?sessionId=1_cc-session_8684f7f6-5f76-4469-a359-c6a510a962db,"As Apple Turns the Corner With the iPhone 17, Should You Buy AAPL Stock for 2026?",2025-10-31T16:15:13Z,AAPL,0.5423,0.6,0.10043575708676224,0.04647062044647402
Biztoc.com,https://biztoc.com/x/9e90adefde9f51de,Apple Experts Bullish After Q4—'Eventual Winner' In AI,2025-10-31T15:46:23Z,AAPL,0.891,0.6,0.09768620082708263,0.05541738172920398
Biztoc.com,https://biztoc.com/x/8be9e0667a4baf42,"Wall Street Loves Apple, Amazon and Nvidia",2025-10-31T15:35:34Z,,0.6124,0.6,0.09667424709149652,0.046763266803098696
Biztoc.com,https://biztoc.com/x/6d6455a200e00c6f,"Apple Predicts Strong December Quarter, Is AAPL Stock a Buy?",2025-10-31T15:23:58Z,AAPL,0.8042,0.6,0.0956006554657657,0.05174481077740034
Biztoc.com,https://biztoc.com/x/e8e333a9677b745e,"Wall Street Loves Apple, Amazon and Nvidia",2025-10-31T14:40:49Z,AAPL,0.9501,0.6,0.0917106926567725,0.05365350652499161
Biztoc.com,https://biztoc.com/x/779c8dce4ab1c3c4,Apple Is Failing in China,2025-10-31T14:30:06Z,AAPL,-0.2716,0.6,0.09076937874754526,0.019834924643913586
Biztoc.com,https://biztoc.com/x/cd56eff9a29bc24a,"Stock Market Today: Dow Rises On Amazon, Apple Earnings; Nvidia, Palantir Rebound (Live Coverage)",2025-10-31T14:18:53Z,"AAPL,NVDA",0.9153,0.6,0.08979449330506384,0.051595017908156626
Yahoo Entertainment,https://finance.yahoo.com/news/apple-upgraded-comcast-downgraded-wall-133358266.html,"Apple upgraded, Comcast downgraded: Wall Street's top analyst calls",2025-10-31T13:33:58Z,,0.3818,0.6,0.0859943998801106,0.035648118526301044
Forbes,https://www.forbes.com/sites/greatspeculations/2025/10/31/google-stock-vs-big-tech-who-is-winning/,Google Stock vs. Big Tech: Who Is Winning?,2025-10-31T12:40:42Z,,0.6369,0.6,0.08169576120571116,0.04011833745528858
Biztoc.com,https://biztoc.com/x/90a716a10c9c262a,Tim Cook Reveals Apple's Ad Business Quietly Set A Record — While Everyone Looked At iPhones,2025-10-31T12:27:42Z,AAPL,0.7506,0.6,0.08067969695889489,0.04237136324887242
Yahoo Entertainment,https://finance.yahoo.com/news/apple-forecasts-holiday-quarter-iphone-121452154.html,Apple Forecasts Holiday Quarter iPhone Sales Above Wall Street Estimates,2025-10-31T12:14:52Z,AAPL,0.9042,0.6,0.07968905489399712,0.0455231694987448
Acecomments.mu.nu,https://acecomments.mu.nu/?post=417139,Daily Tech News 1 November 2025,2025-11-01T08:00:00Z,AMD,0.4215,0.6,0.24940182225767174,0.10635740710178411
Forbes,https://www.forbes.com/sites/brianmazique/2025/11/01/call-of-duty-black-ops-7release-date-pre-order-info-and-details/,"Call Of Duty: Black Ops 7 - Release Date, Pre-Order Info And Details",2025-11-01T07:01:26Z,,0.6705,0.6,0.23572902564052464,0.11813560119974892
Slickdeals.net,https://slickdeals.net/f/18754327-legion-tower-5-gen-10-30l-ryzen-9-7950x3d-rtx-5070-ti-32gb-ddr5-2tb-ssd-1838-24,"Legion Tower 5 Gen 10 30L: Ryzen 9 7950X3D, RTX 5070 Ti, 32GB DDR5, 2TB SSD $1838.24",2025-11-01T07:01:07Z,AMD,0.8591,0.6,0.23565717238828143,0.13143307475611618
Ozbargain.com.au,https://www.ozbargain.com.au/node/931065,"HP OMEN 32c 31.5"" QHD 165Hz Curved Gaming Monitor $239.20 Delivered @ HP Official Store eBay",2025-11-01T06:02:39Z,,0.8544,0.6,0.2227593336750716,0.12392547251011585
Digitalocean.com,https://www.digitalocean.com/community/questions/request-for-refund-due-to-billing-issue-after-project-termination,Request for Refund Due to Billing Issue After Project Termination,2025-11-01T05:57:25Z,,0.9371,0.6,0.221639859536334,0.12880157157234978
Slickdeals.net,https://slickdeals.net/f/18754051-bosgame-p3-mini-gaming-pc-amd-ryzen-7-7840hs-32gb-ddr5-ram-1tb-pcie-4-0-nvme-ssd-360,BOSGAME P3 Mini Gaming PC AMD Ryzen 7 7840HS | 32GB DDR5 RAM | 1TB PCIe 4.0 NVMe SSD $360 (6 replies),2025-11-01T05:05:03Z,AMD,0.8591,0.6,0.2107431696096675,0.11753778798639984
Psdvault.com,https://www.psdvault.com/photoshop-error-fixes/how-to-fix-text-tool-lagging-or-crashing-in-photoshop-2025-quick-permanent-fixes/,How to Fix Text Tool Lagging or Crashing in Photoshop 2025 (Quick & Permanent Fixes),2025-11-01T04:37:12Z,,-0.4104,0.6,0.20516794026757215,0.03629010527452817
Slickdeals.net,https://slickdeals.net/f/18753940-hp-omnibook-5-16-fhd-ips-ryzen-ai-5-340-16gb-lpddr5x-512gb-ssd-479-99,"HP OmniBook 5: 16"" FHD+ IPS, Ryzen AI 5 340, 16GB LPDDR5X, 512GB SSD $479.99 (0 replies)",2025-11-01T04:05:40Z,AMD,0.9454,0.6,0.19903318736101613,0.11615974880763624
The Times of India,https://economictimes.indiatimes.com/markets/stocks/news/wall-st-week-ahead-resilient-stocks-rally-faces-earnings-wave-after-ai-fed-wobbles/articleshow/125009503.cms,"Wall Street Week Ahead: Resilient stocks rally faces earnings wave after AI, Fed wobbles",2025-11-01T04:02:32Z,,0.936,0.6,0.198433712739419,0.11525030035905456
Microsoft.com,https://www.microsoft.com/en-us/research/people/eschouks/?locale=zh-cn,"Esha Choukse, Azure Research - Systems",2025-11-01T03:48:56Z,,0.8316,0.6,0.1958525971930388,0.10761708510563095
Seclists.org,https://seclists.org/oss-sec/2025/q4/112,Re: Xen Security Notice 2 (CVE-2024-35347) AMD CPU Microcode Signature Verification Vulnerability,2025-11-01T02:21:39Z,AMD,0.3092,0.6,0.18006794782421656,0.07072348718743929
ZDNet,https://www.zdnet.com/article/thinking-of-buying-an-arm-based-windows-pc-these-three-issues-might-be-dealbreakers/,Thinking of buying an Arm-based Windows PC? These three issues might be dealbreakers,2025-11-01T02:00:25Z,,0.6072,0.6,0.17642446804450643,0.08506482151233921
The Times of India,https://economictimes.indiatimes.com/news/international/us/us-stock-market-ends-the-october-on-a-strong-note-how-did-the-sp-500-nasdaq-and-dow-perform-heres-the-top-gainers-and-losers-on-wall-street/articleshow/125008358.cms,"US stock market ends the October on a strong note — How did the S&P 500, Nasdaq and Dow perform? Here’s the top gainers and losers on Wall Street",2025-11-01T01:54:42Z,,0.946,0.6,0.1754561888732445,0.10243132306420014
Daemonology.net,https://www.daemonology.net/hn-daily/2025-10-31.html,Daily Hacker News for 2025-10-31,2025-11-01T00:00:00Z,,0.0,0.6,0.15711329630788098,0.047133988892364295
Yahoo Entertainment,https://finance.yahoo.com/news/qualcomm-qcom-unveils-ai-chips-233817990.html,"Qualcomm (QCOM) Unveils New AI Chips, Secures Data Center Deal — Analysts Still Neutral",2025-10-31T23:38:17Z,,0.3182,0.6,0.15386266899544296,0.06084653108093787
SiliconANGLE News,https://siliconangle.com/2025/10/31/digital-transformation-vision-building-ai-factory-future-aifactoriesdatacenters/,Inside AMD’s push to build software-defined AI factories,2025-10-31T23:27:52Z,AMD,0.891,0.6,0.15232741810654005,0.08641534429184017
Freerepublic.com,https://freerepublic.com/focus/f-chat/4349904/posts,Apple isn’t playing the same AI capex game as the rest of the megacaps,2025-10-31T23:00:38Z,,0.5119,0.6,0.14838564846505492,0.06730327857429495
CNBC,https://www.cnbc.com/2025/10/31/cramers-week-ahead-palantir-mcdonalds-robinhood-warner-bros-discovery.html,"Cramer's week ahead: Earnings from Palantir, McDonald's, Robinhood, Warner Bros Discovery",2025-10-31T22:43:12Z,,-0.2023,0.6,0.14591605181810596,0.03491917036059093
Investor's Business Daily,https://www.investors.com/research/investing-action-plan/stock-market-week-ahead-october-marks-a-7-year-best-for-the-nasdaq/,Stock Market Week Ahead: October Marks A 7-Year Best For The Nasdaq,2025-10-31T21:54:51Z,,0.743,0.6,0.13927977878181458,0.07282939632501083
Kernel.org,https://git.kernel.org/pub/scm/linux/kernel/git/torvalds/linux.git/commit/?id=9b041a4b66b3b62c30251e700b5688324cf66625,x86/mm: Ensure clear_page() variants always have __kcfi_typeid_ symbols,2025-10-31T21:47:24Z,,0.0516,0.6,0.1382844171499247,0.04362596792245825
Cfainstitute.org,https://careers.cfainstitute.org/job/vice-president-product-specialist-alpinvest-investor-relations/80940121/,"Vice President, Product Specialist, AlpInvest Investor Relations - Carlyle - London, United Kingdom",2025-11-01T07:45:49Z,,0.4215,0.6,0.24601953049257044,0.10491502877855667
Marketing Week,https://www.marketingweek.com/asda-christmas-grinch-2025/,‘We’ve got a big story to tell’: Asda on using the Grinch to share its price pledge,2025-11-01T07:00:36Z,,0.93,0.6,0.23553997331586213,0.13637764454988419
Marketing Week,https://www.marketingweek.com/christmas-ads-blog-2025/,Argos goes beyond toys this festive season: The Marketing Week Christmas Blog 2025,2025-11-01T00:01:26Z,,0.9081,0.6,0.1573302395551091,0.09006054902853111
Mtrip.com,https://www.mtrip.com/,Show HN: AI that builds travel itineraries from booking confirmations,2025-10-31T21:25:18Z,,0.6486,0.6,0.13537338573551438,0.0669529691170707
Pypi.org,https://pypi.org/project/arcade-hubspot-crm-api/,arcade-hubspot-crm-api added to PyPI,2025-10-31T21:25:00Z,CRM,0.3182,0.6,0.1353342938336862,0.05351929983946954
International Business Times,https://www.ibtimes.com/quiet-revolution-how-jennifer-lonchar-ambioedu-are-rewriting-rules-higher-ed-marketing-3789125,The Quiet Revolution: How Jennifer Lonchar and AmbioEdu Are Rewriting the Rules of Higher Ed Marketing,2025-10-31T20:26:18Z,,-0.5859,0.6,0.12789853018811062,0.015888834405268983
Woocommerce.com,https://woocommerce.com/posts/automation-ecommerce-scalability/,Five ways automation will scale your ecommerce business,2025-10-31T18:41:28Z,,0.8739,0.6,0.11562054901546298,0.06499840404002281
ComicBook.com,http://comicbook.com/tv-shows/list/all-7-the-walking-dead-tv-shows-ranked-from-worst-to-best/,"All 7 The Walking Dead TV Shows, Ranked From Worst to Best",2025-10-31T18:30:00Z,,-0.5434,0.6,0.11435123080696886,0.015663831595938593
Forbes,https://www.forbes.com/sites/samleveridge/2025/10/31/how-gen-z-is-driving-change-in-soccer-from-broadcasters-to-direct-fan-engagement/,How Gen Z Is Driving Change In Soccer: From Broadcasters To Direct Fan Engagement,2025-10-31T18:15:06Z,,0.9356,0.6,0.11272265092632343,0.06545578893989748
Elearningindustry.com,https://elearningindustry.com/scaling-elearning-programs-with-white-label-lms-solutions,Scaling eLearning Programs With White Label LMS Solutions,2025-10-31T16:00:54Z,,0.7906,0.6,0.09906096318870032,0.05321356820570604
GlobeNewswire,https://www.globenewswire.com/news-release/2025/10/31/3178482/28124/en/Trends-and-Strategies-Shaping-the-Missiles-Industry-2025-2033-Strategic-Insights-Reveal-Increasing-Expenditure-and-New-Tech-as-Core-Drivers.html,"Trends and Strategies Shaping the Missiles Industry, 2025-2033: Strategic Insights Reveal Increasing Expenditure and New Tech as Core Drivers",2025-10-31T15:34:00Z,,0.7269,0.6,0.09652853831947338,0.050008539847169575
CMSWire,https://www.cmswire.com/customer-data-platforms/treasure-data-unveils-ai-marketing-cloud-and-super-agent-vision-at-cdp-world-2025/,Treasure Data Unveils AI Marketing Cloud and 'Super Agent' Vision at CDP World 2025,2025-10-31T15:08:10Z,,0.8834,0.6,0.09415749244602908,0.05320086638185535
Wealthmanagement.com,https://www.wealthmanagement.com/financial-technology/summit-financial-a-wealthstack-for-all,Summit Financial: A Wealthstack For All,2025-10-31T15:08:04Z,,0.6808,0.6,0.0941484281222071,0.04747340339634171
Biztoc.com,https://biztoc.com/x/c3a36c14a117d213,Is Salesforce’s (CRM) AI Strategy a Bold Move or a Risky Bet? RBC Remains Cautious,2025-10-31T15:02:49Z,CRM,0.9081,0.6,0.09367378337738212,0.05362168381871485
Yahoo Entertainment,https://finance.yahoo.com/news/salesforce-crm-ai-strategy-bold-145037143.html,Is Salesforce’s (CRM) AI Strategy a Bold Move or a Risky Bet? RBC Remains Cautious,2025-10-31T14:50:37Z,CRM,0.9081,0.6,0.09258002070225539,0.052995581250592054
Biztoc.com,https://biztoc.com/x/2db20147bdf1561b,"TD Cowen Remains Bullish on Salesforce (CRM), Cites Strong Enterprise Software Positioning",2025-10-31T14:19:11Z,CRM,0.7269,0.6,0.08982042033909914,0.046533265165077095
Socialnomics.net,https://socialnomics.net/2025/10/31/salesforce-for-e-commerce-entrepreneurs-managing-inventory-orders-and-cx/,"Salesforce for E-commerce Entrepreneurs: Managing Inventory, Orders, and CX",2025-10-31T14:00:17Z,,0.734,0.6,0.08820090563410876,0.04588211111086338
MarketingProfs.com,https://www.marketingprofs.com/opinions/2025/53927/ai-update-october-31-2025-ai-news-and-views-from-the-past-week,"AI Update, October 31, 2025: AI News and Views From the Past Week",2025-10-31T14:00:00Z,,0.6369,0.6,0.08817685051192267,0.043301005980889866
Yahoo Entertainment,https://finance.yahoo.com/news/td-cowen-remains-bullish-salesforce-135828089.html,"TD Cowen Remains Bullish on Salesforce (CRM), Cites Strong Enterprise Software Positioning",2025-10-31T13:58:28Z,CRM,0.7269,0.6,0.08804678434423915,0.04561439756521998
Yahoo Entertainment,https://finance.yahoo.com/news/lphabet-googl-posts-q3-earnings-233845881.html,Alphabet (GOOGL) Posts Q3 Earnings Beat; AI Helps Boost Search and Cloud Growth,2025-11-01T02:20:45Z,GOOGL,0.7845,0.6,0.17991198427846497,0.09631588078347622
Financial Post,https://financialpost.com/investing/one-tech-giant-outdid-mag-7-cohort,"One tech giant outdid its Mag 7 cohort this week, with analysts rushing to hike their price targets",2025-10-31T22:40:44Z,,0.8207,0.6,0.14556995113368013,0.07951176300872742
Barchart.com,https://www.barchart.com/story/news/35833229/aggressive-spending-spooks-meta-platforms-investors-should-you-buy-the-dip-in-meta-stock,'Aggressive' Spending Spooks Meta Platforms Investors. Should You Buy the Dip in META Stock?,2025-10-31T18:07:06Z,META,-0.4023,0.6,0.11185783126724683,0.020057227724530027
Biztoc.com,https://biztoc.com/x/4ffb8178afe055d4,"Palantir Stock Extends Gains Ahead Of Q3 Results; Robinhood, Qualcomm, AMD Also Set To Report",2025-10-31T14:40:44Z,"AMD,GOOGL,META",0.8641,0.6,0.09170332100086957,0.05128324820331629
Yahoo Entertainment,https://finance.yahoo.com/news/jim-cramer-alphabet-fire-just-134114540.html,"Jim Cramer on Alphabet: “They’re on Fire, Just Plain out on Fire”",2025-10-31T13:41:14Z,GOOGL,0.6124,0.6,0.0865980829516762,0.041889224685384814
MarketWatch,https://www.marketwatch.com/story/everyones-asking-the-wrong-question-about-an-ai-bubble-here-are-the-stocks-to-buy-and-when-b3fddce5,The AI boom is over — here’s your bubble survival guide,2025-10-31T11:31:00Z,,-0.4767,0.6,0.07639379456748188,0.01199306180914898
Yahoo Entertainment,https://finance.yahoo.com/news/great-ai-buildout-shows-no-100532758.html,The great AI buildout shows no sign of slowing,2025-10-31T10:05:32Z,,0.872,0.6,0.07035981771719713,0.03951407362997791
Yahoo Entertainment,https://finance.yahoo.com/news/jim-cramer-says-sold-alphabet-022958157.html,Jim Cramer Says “We Sold Alphabet at the Wrong Time”,2025-10-31T02:29:58Z,GOOGL,0.3818,0.6,0.0453788566492357,0.018811351235374165
Nature.com,https://www.nature.com/articles/s41598-025-22926-y,Integrating event information and multi dimensional relationships for improved financial time series forecasting,2025-10-31T00:00:00Z,,0.8271,0.6,0.039278319862035005,0.021529625465977247
Barchart.com,https://www.barchart.com/story/news/35811187/paypal-is-paying-its-first-ever-dividend-should-you-snap-up-pypl-stock-now,PayPal Is Paying Its First-Ever Dividend. Should You Snap Up PYPL Stock Now?,2025-10-30T23:30:02Z,,-0.6705,0.6,0.03816136686198318,0.0037722511143070377
Yahoo Entertainment,https://finance.yahoo.com/news/analyst-explains-why-bearish-alphabet-210452681.html,"Analyst Explains Why He’s Bearish on Alphabet (GOOGL), Sees ‘Diminishing Returns’ in Future",2025-10-30T21:04:52Z,GOOGL,0.4215,0.6,0.03318410749393623,0.014151362640789105
Biztoc.com,https://biztoc.com/x/c21c1252cfa0ac0e,"Amazon Soars To Record High On Solid Guidance, Improving AWS Results",2025-10-30T20:36:28Z,"AAPL,GOOGL,META,MSFT",0.9231,0.6,0.03228911775416069,0.018628560705907925
Barchart.com,https://www.barchart.com/story/news/35807971/stocks-settle-lower-as-megacap-technology-stocks-slide,Stocks Settle Lower as Megacap Technology Stocks Slide,2025-10-30T20:33:04Z,SPY,-0.25,0.6,0.03218360187116119,0.0072413104210112674
Biztoc.com,https://biztoc.com/x/ec9e277907a83008,AI Powers Alphabet’s First $100B Quarter. Is GOOGL Stock a Buy?,2025-10-30T17:07:04Z,GOOGL,0.8074,0.6,0.02639408551974497,0.014311401050516115
Barchart.com,https://www.barchart.com/story/news/35802032/ai-powers-alphabets-first-100b-quarter-is-googl-stock-a-buy,AI Powers Alphabet’s First $100B Quarter. Is GOOGL Stock a Buy?,2025-10-30T17:01:06Z,GOOGL,0.3818,0.6,0.026242908857040698,0.01087873543759765
The Times of India,https://economictimes.indiatimes.com/markets/stocks/news/morgan-stanley-adds-ril-varun-beverages-to-its-focus-list-heres-why-these-2-largecaps-made-the-cut/articleshow/125011441.cms,"Morgan Stanley adds RIL, Varun Beverages to its focus list. Here’s why these 2 largecaps made the cut",2025-11-01T07:58:45Z,,0.6908,0.6,0.249101835793485,0.12635441518788731
The Times of India,https://timesofindia.indiatimes.com/tv/news/hindi/bharti-singh-steps-out-in-spooky-halloween-look-jokingly-says-shell-hit-paps-with-her-baby-bump/articleshow/125011623.cms,"Bharti Singh steps out in spooky 'Halloween' look, jokingly says she’ll hit paps with her baby bump",2025-11-01T07:52:17Z,,0.8555,0.6,0.24755587148293393,0.13780197586097517
The Times of India,https://timesofindia.indiatimes.com/entertainment/hindi/bollywood/news/tahira-kashyap-pens-heartfelt-note-for-ayushmann-khurrana-on-their-17th-wedding-anniversary-says-you-are-my-constant/articleshow/125012128.cms,Tahira Kashyap pens heartfelt note for Ayushmann Khurrana on their 17th wedding anniversary; says 'You are my constant',2025-11-01T07:39:28Z,,0.9732,0.6,0.24452012926404618,0.14474613571914477
Biztoc.com,https://biztoc.com/x/dc9ef9644df04b6e,S&P 500 Snapshot: Index Posts 2.3% Gain In October,2025-11-01T07:35:31Z,,0.5267,0.6,0.24359206226462585,0.11156760043782128
The Times of India,https://timesofindia.indiatimes.com/entertainment/english/hollywood/news/nicole-kidman-adds-a-touch-of-practical-magic-to-halloween-teases-sequel-to-the-1998-classic/articleshow/125011994.cms,Nicole Kidman adds a touch of practical magic to Halloween; Teases sequel to the 1998 classic,2025-11-01T07:27:12Z,,0.2263,0.6,0.24164953043812856,0.08890044575288311
Biztoc.com,https://biztoc.com/x/487e54a652d6ee3e,Vietnam's ancient town Hoi An works to restore tourism after devastating floods,2025-11-01T07:24:57Z,,-0.4767,0.6,0.24112666321941056,0.03785447485881526
The Times of India,https://timesofindia.indiatimes.com/entertainment/hindi/bollywood/news/anupam-kher-announces-his-next-with-sooraj-barjatya-calls-the-director-an-icon/articleshow/125011974.cms,Anupam Kher announces his next with Sooraj Barjatya; Calls the director an 'Icon',2025-11-01T07:24:07Z,,0.0,0.6,0.24093329565476349,0.07227998869642904
Forbes,https://www.forbes.com/sites/lanceeliot/2025/11/01/prompt-engineering-newest-technique-is-verbalized-sampling-that-stirs-ai-to-be-free-thinking-and-improve-your-responses/,Prompt Engineering Newest Technique Is Verbalized Sampling That Stirs AI To Be Free-Thinking And Improve Your Responses,2025-11-01T07:15:00Z,,0.7351,0.6,0.23882795900005227,0.12431711749829721
Hearthpwn.com,https://www.hearthpwn.com/news/12087-new-ranked-season-november-2025-card-back,New Ranked Season - November 2025 & Card Back,2025-11-01T07:00:00Z,,0.8306,0.6,0.23540392943369223,0.1292791299663951
The Times of India,https://timesofindia.indiatimes.com/astrology/others/tulsi-vivah-remedies-you-can-perform-for-early-marriage/articleshow/125010936.cms,Tulsi Vivah Remedies You Can Perform For Early Marriage,2025-11-01T06:51:44Z,,0.9666,0.6,0.23353793517860377,0.13778271099667266
The Times of India,https://timesofindia.indiatimes.com/education/news/centre-clears-62-new-pg-seats-across-six-odisha-medical-colleges-cm-majhi-calls-it-boost-for-healthcare-education/articleshow/125011448.cms,"Centre clears 62 new PG seats across six Odisha medical colleges, CM Majhi calls it boost for healthcare, education",2025-11-01T06:50:44Z,,0.8955,0.6,0.23331321440141511,0.1326735593693647
The Times of India,https://timesofindia.indiatimes.com/education/news/experts-urge-universal-access-to-education-and-healthcare-warn-against-commodification-amid-rising-inequality/articleshow/125011376.cms,"Experts urge universal access to education and healthcare, warn against commodification amid rising inequality",2025-11-01T06:41:59Z,,0.2023,0.6,0.2313561162201841,0.08344783755945819
Biztoc.com,https://biztoc.com/x/cb93901500027aa6,Egypt’s Geopolitical Balancing Act Wins Over Trump — For Now,2025-11-01T06:40:56Z,,0.5719,0.6,0.23112237017628012,0.1089903761040284
Biztoc.com,https://biztoc.com/x/136eab5622609112,"Amazon Surge Makes Jeff Bezos Richer, Meta Stock Crash Wipes $35 Billion From Mark Zuckerberg's Fortune: What's Going On?",2025-11-01T06:40:46Z,META,0.9623,0.6,0.23108528836966716,0.13603759841033936
Biztoc.com,https://biztoc.com/x/ac99d4784bc2a8bb,Carney Says He Apologized to Trump Over Tariff Advertisement,2025-11-01T06:40:41Z,,0.3182,0.6,0.2310667499625644,0.09137765694019571
Biztoc.com,https://biztoc.com/x/45f3d2dfa2ab659a,"Despite the hype around large AI models, many companies like Meta are using small models for routine tasks, finding them more practical and cost-effective",2025-11-01T06:40:35Z,META,0.3612,0.6,0.2310445058275103,0.09434933439972211
Biztoc.com,https://biztoc.com/x/c6470a917d165dbf,Heidi Klum reveals her much-anticipated 2025 Halloween costume,2025-11-01T06:40:32Z,,0.0,0.6,0.23103338453521127,0.06931001536056337
Biztoc.com,https://biztoc.com/x/f8777b82b1fc9e8c,Shutdown Risks Becoming Longest Ever. Why the End Is in Sight,2025-11-01T06:40:30Z,,-0.2732,0.6,0.23102597055125512,0.050372902618995664
The Times of India,https://timesofindia.indiatimes.com/education/news/delhi-govt-to-recognise-private-schools-in-non-conforming-areas-move-to-add-20000-seats-for-ews-dg-and-cwsn-students/articleshow/125011237.cms,"Delhi govt to recognise private schools in non-conforming areas; move to add 20,000 seats for EWS, DG and CWSN students",2025-11-01T06:36:31Z,,0.0,0.6,0.23014173460000456,0.06904252038000136
The Times of India,https://timesofindia.indiatimes.com/tv/news/hindi/shafaq-naaz-goes-social-media-official-with-her-beau-after-past-heartbreak-calls-him-ghar/articleshow/125011318.cms,Shafaq Naaz goes social media official with her beau after past heartbreak; calls him ‘ghar’,2025-11-01T06:36:31Z,,0.9382,0.6,0.23014173349221229,0.13381821235638175
Yahoo Entertainment,https://finance.yahoo.com/news/morgan-stanley-turns-more-bullish-233903127.html,Morgan Stanley Turns More Bullish on Microsoft (MSFT) After Earnings Beat,2025-10-31T23:39:03Z,MSFT,-0.3612,0.6,0.15397624631424137,0.029508007843661217
Biztoc.com,https://biztoc.com/x/aae2f5a5d2eb6f89,“You’re Going to Burn This Billion Dollars.” Microsoft Stock (NASDAQ:MSFT) Slumps on Original Assessment of OpenAI,2025-10-31T20:32:34Z,MSFT,0.5719,0.6,0.12867244616532295,0.060678065438181335
Biztoc.com,https://biztoc.com/x/5e81a3e58d60e192,Meta Faces a Sudden Reckoning. How Big Tech Earnings Are Reshaping the AI Race,2025-10-31T20:10:41Z,META,0.0,0.6,0.12599003452046798,0.037797010356140394
